komentarClean,cluster
pajak larinya kantong negara,3
telat pajak motor samperin rumah,3
dasar asn pajak tukang pungli,3
bayar pajak kebanyakan dikorupsi,3
bui ketua pajak maling berkelass,3
usaha merintis bayar pajak izin mintav pajaknya ngotak,3
mari galbay pajak,3
pajak palak institusi,3
beli rubikon anak anak pajak,3
pajak pajak pusat kerumah gra pajak kab batang nyelesain pajak bpk w uang,3
pajak takut bertingkah,3
bayar pajak negara oknumnya,3
pajak kbelet beli rubicon,3
klq pajak bayar transaksi terkhusus shmklq bayarharga menjulang tinggikata sihhke kas negara,3
ush byr pajak dtnya bayar bilang nabung beli rubicon,3
dimana muka tukang pajak,3
cita lihat dinkejer pajak bayar contoh soimah,3
bentar lgi bayar pajak liat,3
dukung bersih oknum pajak,3
pajak anak afa rubicon rumah lt piye rakyat indo,3
pajak anjing petugasnya eksekusi,3
cari kesempatan pajak pe ak,3
guys ketemu pajak temen pajak sombong maeeen ternyataaaaa,3
hallo direktorat jenderal pajak ri,3
instansi berprestasi kepolisian pajak,3
andaikan uang pajak berakukannya membangun indonesia,3
prcya malihan ws ng pajak,3
campur aduk dispenda kppsemua dibilang pajak,3
berhenti bayar pajak,3
sebelah bilang silahkan bayar pajak bbm x lipat,3
jokowidodoterbaru mahfudmdofficial pajak semena,3
hadeh pajak enak,3
bayar pajak dibayar pegawai pajak poya,3
gausah bayar pajak pegawai pajaknya bayar,3
pajak aduh kocak,3
pajakny bli mobil motor harley pegawai pajak,3
meni riweuh pajak teh,3
pajak ngambilin pajak,3
orng pajak berulah,3
pajak mata keranjang,3
pegawai pajak sejenis hama,3
cari uang kitayg kerja bikin rumah sibuk pajak,3
pantesan ema kerja dikelurahan dicecer piket turun kewilayah mintain pajak ema cape pajak,3
intinya pajak byar pajak malas byr pajak,3
soima nentukan pajak beli rumah pemda pajak keuangan dibedakan,3
ikhlas bayar pajak hasilnya pegawainya ber attittude,3
nek ngarani pajak karo bea cukai ki cen assssssssss u,3
beuh mayan tukang pajak berbisik bantu urus paham,3
pengen reaksi pajak nonton soimah diem perlakukan,3
instansi pajak instansi kepolisian ade kakak nanya loh bapa,3
ngeri ama petugas pajak istighfar,3
ngapain bayar pajak awokwokwok,3
carilah uang sebanyakbanyaknya pegawai pajak rubicon,3
uang pajak isi perutnya,3
tukang pajak preman upeti,3
emosi pajak hidup tentram dipenuhi sakitan,3
negara kakean utang rakyate diplekotot pajak fakta,3
males bayar pajak takut beli rubicon,3
pegawai pajak target bayar orek terusss,3
yya bikin males bayar pajak,3
pajak gx bayar bajak masyarakat uber bayar pajak uber sruh bayar pajak uang pajak gaya hidup mewa,3
kejam pemerintah yh pegawai pajak bayar baja penjara yh,3
kemenkeuri dengerin preman berkedok berseragam pajak,3
pegawai pajak rat mario hidup damai mgkn peras,3
klau digoogle pajak rumah kena harga rumah rampok berduit,3
gausah bayar pajak gada pemasukan gausah maju negara sinting,3
pajak ngejar ngejar rumah hp diperiksa suratnya,3
bahasa pajak bea cukai masuk pendidikan khusus,3
malas bayar pajak weew,3
kmrin polisi pajak next,3
dudukan ber soimah pegawai pajak mukanya,3
bubarkann namanya petugas pajak,3
pajak mohin pengertiannya nutupin pembayaran pajak,3
pajak pd kena karma,3
pajak iki sakjane waras seh ngguwateli ngene,3
pajak merangkap teknik sipil bisi taksasi nilai bangunan,3
percaya soimah pajak,3
tinggal batam nnya bayar pajak rumah ibuibu bayar pajakknpa batam pajakin,3
pajak bayar diam berkurang bayarnya bayar rendah usut,3
ditjenpajakri males bayar pajak ngasih makan belikan rubicon oknum pajak,3
pajak daerah cok,3
pantes pajak anaknya hedon istrinya hedon byr pajak nafkahin pajak,3
pusing masyarakat urusan pajak,3
hapuskan pajak muka bumiiiiiii,3
pajak takut dosa,3
pajak kekayaan pajak qt mka kejer kejer dc,3
beli rubicon anak pejabat pajak,3
tanteku bikin usaha cafe trs rame eh dateng i pajak sebulan ful utak atik pajak bayar,3
ehhh taunya bapenda bikin surat isinya tanteku bayar pajak cafe buka bangunannya,3
batal nyesal telat bayar pajak motor,3
milyar pajak ngitungnya harga rumahnya,3
proses pajak maling berkedok,3
inti ne pajak mbok ne ancokk kabeh,3
duh gemes pajak aduh,3
ramaika tagar pajak transfaran akses masyarakat pemilik tambang pejabat,3
kacau pajak beacukai,3
pejabat pajak asik rubicon,3
dagang rame dikit kdg pajak dateng,3
pajak bersih kebiasaan memanfaatkan peluang nyuri,3
pajak beacukai uang halal dimakan serius nanya,3
pajak beacukai pikirkan disama ratakan,3
pemerintah ngutang bayar pajak,3
nyuruh bayar pajak bayar pajak,3
trauma denger pajak,3
pajak mabok sintee,3
beli pajak jualin harga segitu lumayan laku dpt cuan ntar pajak kasih juta uda sueneng,3
bayarlah pajak karyawan rubiconcuaks,3
kagetalan pengen beli mobil rubicon pajak,3
pajak mahal ngotak pajak ditanggung,3
habis habis pajak perasaan,3
vendor aplikasi pajak daerah sedih ngedenger cuk asli real,3
kemenkeuri beacukairi direktorat jenderal pajak ri,3
pajak pajak pajak meresahkan,3
pajak tembus target bonusnya rubicon make,3
direktorat jenderal pajak ri punten,3
bayar pajak pakai maksa,3
rat byr pajak setahun cm ribu pdhal aset digeledah kpk,3
ndang bayar pajak nggih ting tong misi rubicon kwocak,3
targetnya kebeli rubicon pegawai pajak,3
pajak pbb berulang tagihan dibilang terbayar murah,3
pajak parah belanda menjajah warga usir pajak negara,3
pengen seandainya bayar pajak nasib bangsa maju,3
pajak proses penggemukan perut,3
ayooo bayar pajak,3
enak pajak ngeemail mulu lupa bayar pajak tahunan ehh duidnya tilep lu nyari duid ngeruk pasir,3
pajak gila uang kerjanya foya lol,3
pajaknya bayar pajak dasar preman,3
pemerasan berkedok pajak,3
masyarakat bayar pajak raya,3
apapun jenis djp daerah masy memahami pajak tk edukasi ttg jenis pajak,3
pantesan pajak suka pajak semestinya dept collector bayar pajak ketiga pencucian uang,3
direktorat jenderal pajak ri hmm,3
uang pajak hasil ngoyak ngoyak soimah korupsi pegawai pajak,3
pajak bphtb emng gtbeda pph badan pendapatan daerahnya hrs ditegur,3
pajak atasan ngurus pajak bermasalah,3
muhammaddesnanto stop bayar pajak,3
mampus gada bayar pajak,3
email dirjen pajak ri cuekin,3
pajak bayar pajak uang bayar pajak,3
pajak rakyat memperkaya pajak,3
sekitaran situ rumah pegawai pajak,3
malu pajak kemaren hbs anaknya petinggi pajak pamer mobil mewah eh taunya uang hasil maling bokapnya amit,3
rumah mesti bayar pajakpajak pajak pajak bulsit dahhh hidup susah susah,3
dirjen pajak ri klarifikasi,3
pajak berasa bumi hak milik cuaksss,3
pajak adem panas,3
pajak bea cukai ladusing paraaaahhhhhh,3
pajak bumi bangunan bphtb pajak kendaraan djp pajak kemenkeu badan pendapatan daerah bapenda kotakabprov,3
tolong kondisikan pajak wakil rakyat joko widodo ri,3
uang pajaknya dipake pajak hidup hedon,3
pajak bea cukai percaya,3
pajak isine tikus garangan codot,3
belangny orangny pajak,3
bayar pajak gendutin pejabat,3
buruan bayar pajak pegawai pajak beli rubicon tas mahal istrinya,3
bayar pajak eewong uangnya kantong keluarganya,3
pajak bermasalah demo usut tuntas ampe bersih,3
bayar pajak ampe ratusan juta huhuhhu,3
cepet bayar cepet bagiin kolega kacau ditjet pajak,3
pajak polisi beacukai dpr meragukan percaya,3
indo adl sasaran empuk pegawai pajak memperkaya,3
gausah bayar pajak dirjen pajak bersih,3
pajak merangkap pu tata kota hitung rab draft keren,3
direktorat jenderal pajak ri bl rubicon,3
instan pegawai pajak,3
rakyat rajin bayar pajak dinikmatin petinggi kantor pajak,3
bayar pajak seng kenyang sopo yoooo,3
makan uang pajak hati nurani liat gelandangan jalan jalan liat jalan rusak,3
pajak sejenis penyakit iri hati senang klw rejeki,3
direjen pajak anjggg,3
pajak bayar bayar pajak pajak bayar pajak,3
pajak gabisa obyektif sotoy berdasarkan asumsi spekulasi,3
pajak uber cicilan bank sibuk nguber berduit,3
soimah oyak pajak masyarakat,3
pengangguran karyawan pajak drpd rakus harta yok yok kiamat percepat drpd ngeliat skenario pajak,3
bangsat didirjen pajak,3
nyesel taat pajak,3
pajak panas dingin ditagih atasan setoran pakek bayar utang negara,3
pajak dc nagihnya,3
direktorat jenderal pajak ri pjak bnyk byar pajak oknum bnyk,3
ngapain bayar pajak beli mobil,3
pajak mo beli rubicon alphard,3
berwajib kena gara sambo pajak gara rubicon besoknya hayooo,3
sdgkan pajak bayr pajakudah bayar pajak makan uang pajak,3
rumah pajak pbb megang pemerintah daerah salah kaprah teman pajak kpp pajak penghasilan,3
pajak beli rubicon istri pajak bli tas hermes,3
keputusan bayar pajak keputusan bijak,3
males byr pajak enak tk biat sedekah langsung,3
penentuan njop tanah bangunanpbb ranah pajak daerahdispenda,3
pantes anak orni pajak berani aniaya anak ornk smpai mati,3
warga negara indonesia taatilah membayar pajak rubicon pamer sosmed,3
bayar pajak motor njirrr,3
mak bajingan pajak,3
kemarin habis jual rumah maaf rumah lumayan rusak deal pembeli eh kena ruet pajak,3
harga lipat untung kemarin ngurusin pajak kenal langsung nego pajak loh gatel,3
usut oknum pajak mafia kompak,3
paham knapa pajak,3
ki pajak opo tukang to,3
bayar pajak pelayanan masyarakat bagus its oke kenyataan nol,3
hahahaha payah pajak,3
bobrokkk bobrokk bea cukai pajak polti pimpinannya oknum ngawurr kerjanya bobrok negri,3
bayar pajak rubicon,3
pantesan pajak gajinya beli rubicon rumah mewah setahun mustahil,3
petugas pajak kagak pajak bayarnya kagak bayar pajak hahhaahha hall pajak rakyat,3
pajak ngelunjak parah lembaga pajak ketimbang,3
gausa pajak keenakan dipaksa bayar beli rubicok,3
pajaknya bayar pajak jgjd mlh ngejar bayarin pajaknya skalian,3
byr pajak kebanyakannya korupsi,3
gausah bayar pajak bayar uang dipake perkaya,3
dpr polri ditjen pajak bea cukai trs percaya rakyat indonesia,3
pajak taat pajak,3
ayo kecurangan pajak menangah menyerang yu bongkar,3
angel wis angel ra byar pajak,3
pantes kayawong uang pajak beli rubicon tas tengteng,3
masyarakat beres urusan pajak harap laporkan mencekik rakyat,3
klarifikasi ditjen pajak silakan kunjungi ditjenpajakri,3
wktu pndah rumah mertua bayar pajak smpe ribu lahan taun smpe juta dri taun,3
mlah lahan tebing pinggir jln pajak ribu rmh ibuku deket jlan raya pajak dri ribu,3
pajak taun lunas kluar terhutang,3
bayar pajak mensejahterakan pegawai pajak keluarganya,3
sabar utang negara indonesia ribu an triliun dikejarkejar pajak bayar utang negara,3
jado soimah beli rumah juta jual pajak juta lumayan untung harganya juta,3
masuk surga menarikmematok pajak cukai,3
pejabat pajak kontol,3
kasian pajak belom beliin baju lebaran anak bini rumah cuppp cuuppp bayar soimah kesian eaeaea,3
keputusanku bayat pajak motor diancam motor bodong tahunn,3
peraturannya pajak rugi hrga njop dri harga beli,3
pejabat pajak maling uang pajak,3
pajak rakyat bikin pejabat,3
pegawai pajaknya bayar pajak,3
pajak tolongg pajak,3
pajak rumah ngitungnya perorang pajak dapet wkwkwkw canda,3
percaya soimah institusi pajak indonesia,3
pajak potong pajaknya leher tukang pajak,3
bukanya malas bayar pajak males ngasih uang pengangguran berkedok petugas pajak,3
bayar pajak korupsi,3
tukang palak berkedok pegawai pajak,3
oknum oknum pajak,3
baiknya pajak hapus lihat komen,3
pajak preman yo soimah,3
dirjen pajak ri tangapanya,3
tukang pajak tukang palak kayaknyaa,3
pajak ngilerr pengen beli rubicon,3
trust issue pajak,3
temen katax pencuri dikantor pajak allahualam,3
pajak beli pesawat makkk,3
pajak knapa sadar,3
direktorat jenderal pajak ri inget hisab pakdi akhirat perih loh balesan,3
pengen mobil rubcon pajak,3
pajak campur urusan kesepakatan penjualpembeli salah smpe nentuin harga transaksi,3
bayar pajak brubah bayar jalan rusak bangunan bnyk terbengkalai,3
gedein hrg berdasarkan nilai jual pajak,3
dpr polisi beacukai pajak bpjs dokter perasaan kerja mogamoga tni,3
pajak ditiadakan gasih kebanyakan ngarang harga naikin limit masuk akal bubarin,3
petugas pajak pemeras modal,3
pajak bisnis haram orangnya kebanyakan,3
pemerintah wajar tukang pajak meras masyarakar,3
dijajah bangsa yakatanya lapor pajak didenda kerja dipabrik dipotong pajak laporan bayar pajak,3
bayarin pajak bayar pajak,3
males pajak kendaran kebutuhan anjing pajak,3
bilang oknum uang pajak beli mobil harganya miliaran jalan bolong pedulikan,3
pajak lagii pajak lagiii,3
petugas pajak bayar pajak masyarakat bayar eh,3
bilang pajak uang kerja pajakin mulu,3
dahlah bner bayar pajakmakin males bayar pajak nyari duitnya mati masuk saku kas negara,3
bayar pajakpegawai bayar pajak,3
i i kaga bedain pajak daerah dg pajak,3
bayar pajak telat dendaaa ajg,3
oranh pajak malingnyaa cuaksss,3
pajakandi periksa semuabayar pajak,3
pajak kreatif saking kreatifnya jam smpe jam ngitungin,3
pd rakus direktorat jenderal pajak ri,3
klarifikasi dri pajak,3
musti taat pajah hinga ahkirnya pra pegwai pajak pakai rubicon,3
pajak sistem palak,3
pajak hatinya tega tega,3
saudara sebangsa setanah air mari bersatu bongkar kebusukan oknum pajak,3
hmmm menyebalkan oknum pajak,3
pemasukan terbesar negara pajak kemiskinan pembangunan negara lantas kemanakah uang pajak,3
pajak bea cukai butuh uang lebaran kah,3
pajak solat pajak wajib pajak,3
lahan basah cuci cuan stop bayar pajak wess,3
pajaknya beli rubicon bayar pajak,3
dirjen pajak mesti dibenahi ilang trust masyarakat klen,3
bubarkan dirjen pajak stop bayar pajak,3
kyak hasil nagih pajak penagih,3
rakyat indonesia mogok masal bayar pajak,3
pajak pajak dapet surat pajak gajian gaji baayr pajak baqbqbi,3
thats why islam pajak haram hukum islam pajak am riba bikin susah rakyat diharamkan,3
pengen liat muka pajak tugas,3
maling katanyadirektorat jenderal pajak ri,3
pajak suka berurusan artis taulah,3
bayar pajak ora sudi,3
pajak beli rubicon tah chuaaks,3
orng pajak bayar pajakkorupsi laginegri in hancurrrrr,3
keren pajak itungannyabelajar dmn,3
sokan nagih pajak mreka sndiri bolong bayar pajak kocak pegawai pajak,3
nomer persis kejadiannya dimana beli segini pajak melebihkan pdhal nota pembelian,3
bayar pajak manjain anak beli barang mevvah cuih,3
soimah kerja pegawai pajak foya foya,3
jijik liat pajak,3
iklas gaji laki lembur kena pajak gilaan,3
jujur malas bayar pajak,3
tukang pajak butug uang,3
embuhlah negara isine pajak thok,3
membayar pajak wajibtapi sia sia pajak bayar masuk negaratapi dinikmati oknum,3
pajak nglihat kewajaran perhitungan aslinya,3
tukang pajak kerjaannya memeras rakyat,3
malas byar pajak motor serius malass unduh telat bbrp bln bodo pjk,3
pajak mayoritas pajak,3
apasih pajak dipake bangun jalan dipake korupsi beli dior sekeluarga,3
pajak bermain pajak,3
nga bayar pajak selagi presiden,3
bikin video jenis pajak diomongin soimah dikelola direktorat jenderal pajak,3
pajak pajak bikin rakyat makmur bikin sengsara,3
perusahaan sebelah kena palak bea masuk juta kena pajak juta bermain dg pasal dijadikan tameng,3
mari hastag stop bayar pajak pajak habis perut hutang nambah teroooosss bablas,3
pesawat jatuh juta lion air isinya pajak nunjukin kuasanya,3
yok rame gausah bayar pajak,3
pencapaian pajak melebihi target hebattt,3
nalangin pajaknya pajak,3
spil tetangga pajak,3
nggak negara pajak,3
astaghfirulloh buk pajak bekerjalah jujur akhirat,3
pajak membangun rumah,3
orng pajak meresahkan oknumnya,3
terinspirasi pajak rubicon,3
bayar pajak alasan pmbangunan fck cba htung pmbangunan sma hsil korup bnyakan mna fck pajak,3
pajak makan uang pajak,3
pajak bea cukai ahh,3
pajak lgi liat endinga,3
klw situ bayar pajak foyafoya,3
pajak bumi bangunan pbb ditarik bapenda yaaa djp kemenkeu,3
koncone karyawan pajek yo lolosne lek bayar pajak,3
nggak bayar pajak wis,3
aji mumpung rame mafia pajak wajib pajak nakal,3
pantesan pajak ngitungin,3
rajin bayar pajak,3
nama tukang pajak main todong,3
pajak lupa bayaran hidup tertib bayar pajak,3
pajak hapuskan damai,3
pembangunan infrasturktur negara pajak ngutang hujat hutang negara,3
pajak jadian kena,3
boikot pajak reformasi pajak,3
komando gausah bayar pajak,3
capek kerja pagi pagi pajak gampang kebelet pen robicon,3
kantor gayus kantor pajak dalamnya kader gayus,3
percya pajak skrang,3
uang pegawai pajak kasih keluarga anak anak uang haram,3
rat pajak berani nagih pajak takut dibantai wajib pajak,3
direktorat jenderal pajak ri piye iki bosss,3
pajak isi bajingan nyari seseran jor joran malak mengatasnamakan pajak,3
berantas koyak pajak merusak kegidupan umat pajak,3
hahah wibu pajak,3
kebanyakan orng pajak makan hasil uang haram ngerii jugaa,3
hmmm pajak membagongkan,3
ditjen pajak ri hallo,3
ngebet beli rubicon pajak,3
soimah artis rakyat jelata budak corporate dapet surat cinta pajak,3
preman pajak negri,3
pajak bea cukai impian,3
stop bayar pajak fix uang beli rubicontl,3
proud kerabat family pajak,3
iku jenenge pajak gendeng,3
klasemen pajak bea cukai,3
pajak jujur jalan dikampung ancur,3
bayar pajak memperkaya petugas pajak,3
pajak sistemny preman versi legal,3
fix pajak bea cukai isi binatang binatang suka uang,3
makan ajj susah belan bayar pajak eh pejabat pajak bayar pajak bikin raya,3
direktorat jenderal pajak ri hello,3
bayar pajak makan pajaknya,3
bayar pajak guys soale uang embat,3
pajak bayar pajak buk ketemu,3
gila jatuhnya morotin pajak gilee bngtt,3
alhamdulilah motor bayar pajak telat bayar berasa bersalah sekrang bersyukur nunggak motor,3
oknum pajak bea cukai diberantas habis indonesia maju maju,3
direktorat jenderal pajak ri vemerazzz,3
direktorat jenderal pajak ri kepencet sumpah,3
pilihan gamau bayar pajak mtr semenjak perpajakan pantek,3
ditjenpajakri pajak byr pajak,3
bayar la pajak pegawai pajak rubicon,3
woi pajak nongol,3
males bayar pajak aslideh,3
pajak bikin susah,3
pajak daerah protes berhubung soimah pembeli kenanya pajak bphtb,3
pajaknya bayar pajak nilepin uang pajak,3
pajak serakah gmnmakin kesini mencekik biaya pajak duh gusti,3
pajak bea cukai batam diobark abrikmonggo kpk,3
pajak konoha bea cukai konoha,3
pajak nagih rakyat gercep,3
gila yaaku cinta pemerintah cinta dirjen pajak,3
ranah pajak daerah teman pajak pusat gada sangkut pautnya mengelola,3
pemalak berkedok pajak,3
mkx artis pikiranx uang beli rumah tanah man pajak tanah,3
beli rubicon bebas pajak selebrasi siuuuuu,3
petugas pajak urusan,3
bubarkan jajaran staf pajak skg bangun bertanggung jwb,3
sengsara orng pusing bayar pajak,3
bayr pajak mobil kmren bayar cash trf debit bayr pajak cash uang kemanakan,3
untung bapa bayar pajak awowkwkk,3
tolong guys kecewa masyarakat terhadp dirjen pajak pungutan serem yaaa,3
pajak lulusan stan pembaruan nie stan,3
direktorat jenderal pajak ri kemenkeu ri,3
uang pajak masyarakat pegawai pajak,3
rip dirjen pajak,3
pajak malu lu gabayar pajak direktorat jenderal pajak ri,3
pokoknya korupsi kerjanya pnbp pajak uang setorka bayar setor,3
polisi pajak next,3
bayar pajak jajan kekayaan urusin kekayaan diumpetin,3
pajak pajak ngasu,3
kedai makanan datengin bayar pajak pendapatan pajak baliho nama bakso pajak banner bakso kedai,3
nitizen emosi pegawai pajak dicek kekayaanya ky,3
gila pajak pengen cepet,3
direktorat jenderal pajak ri nyari lebihannn beli rubicon,3
dasaaarrrrrrr pajak,3
petugas pajak dc hahaha oknum brantas,3
pegawai pajak paraah muslim hatihati loh dunia akhirat,3
pajak nggak beli motor gede mobil mewah,3
kelakuane pajak kebongkar sitik,3
giliran pajak diuber harga dibilangnya kw hartanyangadi,3
dirjen pajak beacukai dpr trs sebutkan beres negara konoha,3
pajak suka nginjak,3
kartu keluarga ngitung pajak emng asli pajak jauuhhhh,3
emamg cuaks pajak negri sodarapertanggung berat ahirat,3
maksa bayar pajak pajak bayar pajak uang pajak makan beli rumah mewah rubicon,3
sejatinya orangorang pajak orangorang miskin mata duitan,3
pakek lawyer gtbiar tipu pajak mkst,3
duitnya pajak foya pajak,3
rakyat bangun utilitas negara pajak ngelewatin rumah,3
gausah bayar pajak beli rubicon,3
pajak orabakal iso bijak,3
bayar pajak mobil telat kirimi surat cinta rincian pajaknya,3
uang abis anak pegawai pajak,3
dirjen pajak ri pliss oknum oknum,3
pegawai pajak ceksemua pegawai pemerintah indonesia,3
mikir x bayar pajak,3
rakyat byr pajak rakyat byr pajak pidana rakyat byr pajak pidana hayo sp,3
abang bayar pajak disadari,3
drjen pajak drjen bea cukai,3
libur bayar pajak,3
departemen cuman pajak depag diperiksa,3
mikir kalw bayar pajak srkarang mh aaahhh,3
absen bayar pajak,3
cari koperasi thun bayar pajak mobil thun,3
merhatiin pegawai pajak mobil tanahnya,3
mario pahlawan pajak,3
az potong pajak juta delapan ratus,3
bayar pajak telat takut,3
yok bahas trsbiar evaluasi pajak,3
pegawai ditjen pajak,3
pantes pajak naikan trs beli moge,3
nggak tenang pegawai pajak,3
periksa lingkungan pajak cukai,3
pd gaaa bayar pajak,3
yaaaa bayar pajak mtr ngap engapaaan,3
pantasan pajak trussssssssss,3
haruskah bayar pajak rumah pajak motor pajak mobil pajak gaji pajak,3
inisemua pajak terbuka mantaaap,3
sakit bayar pajak,3
gila rakyat makan seadanya pajak telat gaya hidup bermewahmewah an,3
istrahat kasian ut bayar pajak sakit hati,3
nyesel kuliah jurusan pajak,3
hapus pajak indonesia,3
bayar pajak caloin pejabatnya,3
diejen pajak pusat perksa pajak propnesi kebupeten kota hars turun kpk priksa,3
semuga pajak turunkan harganya rakyat bayar pajak semuga perbaiki baiknya pajak,3
mari kompak bayar pajak,3
dirjen pajak bayar pajak,3
pgn kerja dirjen pajak gpp th,3
klw stop bayar pajak gimna,3
untung q prnh byar pajak dri sd,3
pajak dunia pajak,3
byr pajak kewajiban pajak jujur urusan tuhan,3
mantapperiksa pajak,3
pantesan bayar pajak berat,3
nyesel puluhan taat bayar pajak,3
pajak telat didenda bayar cor riword,3
bur pajak bangkrut negara,3
semenjak kejadian membayar pajak motor,3
rakyat audit pegawai pajak indonesia kabupaten tingkat propinsi,3
pajak oooo pajak,3
bersih institusi pajak bayar pajak ditjenpajakri,3
pegawai pajak krennnpajak kn uang negara uang rakyat,3
pegawai pajak cek pejabat,3
gas melaksanakan mogok pajak,3
pajak instansi pemerintah cek,3
untung motor mobil mati bayar pajak biarin ajalahh,3
indonesia bebas pajak,3
kagetbkn hnya pegawai pajak,3
sekian pejabat pajak,3
bayar paja sory thn bayar pajak,3
mikirin bayar pajak sawah sono hidup serba mewah,3
arus kompak bayar pajak masse,3
gerakaan anti pajak,3
suami telat pajak sehari tidur,3
maaf byar pajak lagimendingan beli beras,3
bayar pajak kendaran elit jalan sulit,3
bayar pajak menteri nagih,3
pajak kah pengen donk dirjen pajak,3
berhenti pajak bayar,3
cuan ceperan penerimaan pajak t,3
buruh kena pajak,3
kerja pajak duitnya tmn bapaknya kerja pajak mewah gaya hidupnya thn heran,3
nasib bayar pajak,3
sia sia nunggak pajak,3
lumayan low bayar pajaktelat dendamau bayar pajak,3
masrakat wajibkan bayar pajak menikmati orangpajak,3
beruntung bayar pajak kendaraan,3
gerakan anti pajak gansi,3
warga nu bayar pajak,3
ane stop bayar pajak,3
bayar pajak negara bayar pajak pegawai,3
makan nga pajak rekrut pesantren n masuk uang,3
libur bayar pajak pegawai pajak hidup auto surga,3
pajak astrea grand kerja pajak hidup mewah,3
rahasiai pegawai pajak makmur sentosa,3
dirjenpajakri dirjenpajakrii raya bantu taat pajak makan susah usahakan byar pjak,3
polisi mewahdpr mewah dirjen pajak mewah kemenku mewah,3
polisi hedon pajak kepala daerah kena ott duh duh,3
mario sebetul membongkar pajak,3
lahbaru pegawai pajak hedon,3
ngeri mo bayar pajak pikir,3
kebongkar pegawai pajak,3
serukan gerakan anti pajak,3
periksa pegawai pajak resufflesemua,3
pegawai pajak bea cukai pemain,3
hahahaha ayo demo turunkan pajak pertahun,3
bayar pajak pejabat pakai rubycon,3
rumangsane uang pajak milik pegawai pow,3
sudi bayar pajak,3
dengerin tuhhhhhh dirjen pajak ri,3
apapun bayar pajak trauma,3
dandi pahlawan pajak,3
sapu bersih lingkungan ditjen pajak bea cukai,3
besok ogah pajak,3
negara rakyat bayar pajak,3
gaji umr juta kejar pajak gaji karyawan pajak juta inflasi produksi barang jasa dpt gaji juta,3
rakyat byar pajak,3
auto bayar pajak,3
rajin bayar pajak deler rubicon sepi,3
ahhhhh anti pajak pokonamah,3
ayoo rakyat stop bayar pajak serentak,3
pajak wajib pegawainya mewah mewah,3
dinas pajak audit kdinasan cek audit,3
sorry sri mulyani males bayar pajak datangi rmh bayar pajak,3
usut aset pegawai pajak,3
dak sudi bayar pajak,3
kpp pratama meulaboh pegawai pajak rumahnya besarrrrr x,3
bayar pajak bayar upeti,3
bayar pajak bayar pajak nantik bertambah mobil rubicon,3
hayoklah rutin bayar pajak kawan dirjen anggota pajak beli harlay rubicon,3
sharusnya rakyat hrs bebas pajak rakyat mrdeka,3
sri ajak kpk kejaksaan periksa harta kekayaan pejabat pajak,3
direktorat terbecek konoha bea cukai imigrasi pajak,3
keringat bayar pajak,3
biarin motor muterdikampung kaga usa bayar pajak,3
kite bayar pajak motor susah stengah mati,3
deal bayar pajak,3
bayar pajak etoll,3
pegawai pajak dendam nggak agnes dandy,3
ganti semau pgwe pajak msih byak dudki bangsat susah,3
pantasan dikit pajak dikit pajak ooooh,3
rakyat makan indomie telur bayar pajak bangga eh tilep pegawai pajak,3
gass yok bayar pajak,3
duhh rakyat kcil bayar pajak motor maless,3
maling pajak dn bea cukai,3
tlng rkyt indonesia brentih byar pajakkta rugikan kantor pajak,3
motor ditilang polisi byr pjak byar pajak,3
lu pajak mobil motor,3
mobilq mati pajak kyg,3
rahasia pegawai pajak hidup mewah,3
audit pegawai pajak bea cukai,3
malez bayar pajak,3
dana haji vs dana pajak,3
diperiksa pegawai pajak,3
ngapain ndak pegawai pajakkalau pegawai pajak menikmati,3
uang pajak membantu kehidupan berdasi ayo bayar pajak,3
ampe nabung bayar pajak cicilan kendaran ehhh bayar ber mevah mevahan tuhan,3
bayar pajak biaya gaya hidup pegawai pajak,3
benahi pejabat pajak dinaikan senang menyusahkan rakyat,3
mario dandy pahlawan gerakan anti pajak,3
harusakah taat bayar pajak,3
dirjen pajak sehattt,3
prei bayar pajak,3
pantesan pajak menteri,3
pajak kades desa suru periksa kpk,3
club motor anti pajak,3
pajak langsung langsung tahapan transaksi bikin ribet kadang menakutkan,3
bayar pajak thn kendaraan bodongmo,3
bayar pajak kendaraan sulitharus,3
motor mio pajak hidup,3
cita dirjen pajak,3
yo bayar pajak yo,3
ayo bayar pajaksupaya pegawai pajak hidup makmur,3
hati bayar pajak,3
gembar gembor pendapatan pajak targetkan,3
wkwkwkwkwkwk bayar zakat rakyat bayar pajak ppn,3
bayar pajak peras keringat broooow,3
bayar pajak punah gayus robicon ketahuan,3
rakyat menggutang bayar pajak,3
