komentarClean,cluster
heran makan uang pajak mesti idupnya sengsara,3
bayar paja pajak belik rubikon,3
pajak ngukur pagi smp sore ormas nungguin jatah nasi malak cuekin,3
pajak dipake mukulin,3
gabayar pajak anjing,3
stop bayar pajak bangkrut bangkrut,3
pantes pajak haram,3
jual beli sepakat juta pajak aneh jual beli ngatur,3
pegawai pajak diperiksa nihsikat oknum oknum merugikan masyarakat negara,3
anjing pajak babi,3
pajak bayar pajak rakyat diuber maling,3
pajak mahal negara miskin,3
nga bayar pajak guyss kenyang pemerintah,3
pajak pajak lagihabis pajak salah target,3
oknum pajak thu mantan kuli bangunan nilai rumah,3
mafiapajak bayar pajak salahgk dibayar salah klian trlalu nyaman makan uang haramjdinya gituu,3
oknum pajak oknum periksa pecat busuk buang,3
kejadian logo toko samsung mall kena pajak bayar pajak pajak denda juta wkwkkk,3
bersyukur gapernah bayar pajak npwp,3
no comment hubungan pajak,3
oknum pagawai pajak kota sibolga,3
jeng jeng direktorat jenderal pajak ri,3
ragu bayar pajak mobil kedepannya,3
hasil ngumpulin pajak pribadi,3
emng diajarin dosenku sma pajak dgunakan harga normal bukn hrga asli,3
nyusahin aje lu tukang pajak,3
dirjenpajakri ditjenpajakri oknum pajak merajalela cari cuan haram,3
susah bajak preman bajak pajak,3
kadang percaya dinas pajak negri tercinta,3
bea cukai pajak temptnya surga barang uang dls disitu,3
direktorat jenderal pajak ri hayooooo,3
jane pajak opo to,3
pajak ketar ketir bnyak permasalahan,3
kayanya masyarakat males bayar pajak,3
harga pajak meninggi,3
taat pajak memakmurkan koruptor,3
gausa bayar pajak,3
hukum syariah pajak haram,3
pajak bea cukai meresahkan,3
pajak bayar pajak ribu kalah buruh pabrik,3
uda bilang pajak haraaaaaaaaaaam efek sampingnya gpp kena batunya,3
direktorat jenderal pajak ri lawak,3
ikhlas gaji potong pajak,3
nguruss pajak pbb rumah djp gaesssss ranahnyaa pemdaaaaaa,3
pajak dirjen pajak ri,3
info loker pajak boss,3
mkanya pegawai pajak,3
info loker dirjen pajak guyss,3
yauda gausah bayar pajak karyawan pajak bayar ngapain bayarbuat apauntuk,3
iku uang pajak kanggo tuku opo,3
astaga denda telat bayar lipat bayar pajak,3
pajak indonesia mahal bayar pajak demo negara,3
ditagih pajaj kasih motornya ptugas pajak,3
diperiksa ptugas pajak periksa petugas pajak sapa yak,3
pantesan tmen bokapnya tajir ehh pegawai pajak,3
soimah pajak cepet ituu beli kuda terbang,3
susah kejar kejar pajak,3
pajak pajak bayar pajak,3
bayar pajak petugas pajak rubicon,3
gausah byar pajak,3
rmh urusan pajak daerah,3
orng pajak byar pjak,3
soimah npwp kagak tips bikin rumah kena pajak,3
direktorat jenderal pajak ri dengerin nohh,3
byr pajak duitnya msk kas negara,3
trnyata omongan gasetuju anaknya masuk kerja pajak bea cukai alasanya,3
bayarlah pakak pegawai pajak beli rubicorn,3
suami sepupu kerja pajak ob beli rumah tanah ama pemancingan kt suka bantu lobi,3
halo direktorat jenderal pajak ri,3
masuk pajak dibawah pemerintah daerah kementerian keuangan bapenda badan pendapatan daerah,3
ingt pajak berlipatdri thn kmarin,3
pajak beli rubicon,3
alesan bayar pajak,3
direktorat jenderal pajak ri monitor,3
ditjenpajakri bedanya pegawai pajak pemalak,3
males bayar pajak fix lapor pajak,3
pajak liat video,3
pajak pengen dpt thr mak ee,3
beli rubicon dirjen pajak ri,3
tapii property harga rumah dibawah njop dicurigai susah dipercaya bayar pajak ikutin harga njop,3
rumah second dijual dibawah harga njop bayar pajak amanya ngikutin njop,3
bayar pajak pajak beli rubicon,3
petugas pajak dispenda ranah bapenda,3
yes kerja notaris mengajukan pajak harga jual beli manipulasi pajak percaya debat,3
kebanyakan gamau bayar pajak mantan bosku,3
pajak bapenda dirjen pajak ssp pajak penjual mengacu bphtb disetujui bapenda,3
pantes pajak ki ora ono sik mlarat,3
spill tik tok pegawai pajak,3
alasan knpnorg pajak raya,3
pantesan pegawai pajak negeri konoha raya,3
pajak mengejar kayakarna tauu,3
case soimah ranahnya bpprd pemda ditjen pajak,3
kasih uang pelicin beres mengurus client beli rumah harga juta pajak kasih juta jajan minggu surat,3
generasi muda kerja kantor pajak,3
benr mengalami percya harga asli naikan harga pajak pendapatan,3
harga jual diatur penjual soimah harga real pajak naikin harga bphtb lumayan,3
tag kalik direktorat jenderal pajak ri,3
pajak bayar pajak gaa cuman memeras rakyat,3
koruptor pajak apapun negara miskin lihatlah qatar brunei bebas pajak alamdisini,3
beli tanahnya murah bayar pajak bphtb harga jual daerahnya lgi bangunanya,3
pajak koprasi kwkw,3
pajak byar pajak,3
pajak meresahkan anjyuu,3
peraturan menghambat investor negeri pajak cukai beserta oknum stafnya,3
jelasin pajak daerah ukur djp,3
pajak meresahkan,3
pajak kebeli rubicon soimah,3
temenku suaminya pajak gayaanyaa liatnya ketawa,3
pajak cen ngono kui,3
capek bayarin pajak duitnya foya,3
pajak beacukai tikusss,3
dk pegawai pajak ck ituini oknum,3
pajak beli rubicon nguber,3
pajak bobrok isi jaih dpr,3
pajak bphtb emng beli tanah juta juta harga tanah daerah tsb juta,3
lokasi updating sppt pajak bumi bangunan njop sbgai dasar pengenaan pajak bumi bangunan,3
hati pjk buruan bayar pajak ajan jalan jalan,3
dengerin kerja pajak,3
pajak depkolektor,3
pajaknya harta an ngindarin pajak progresif,3
pajak tukang soimahpancawati,3
pegawai pajak anaknya,3
honorer bapenda banyumas ngurusin pajak pbb p,3
sop sop dijalankan dg dijalankan rubicon rumah gedong bayar pajak ratusan ribu,3
nyampe pajak weydann,3
yaaa jengkelll pajak kejadiann,3
mb soimahkita bli percy hrganyakan aneh pajak,3
greget mae pajak didenger pajak,3
bales wa rang pajak bayar pajak,3
pajak woimungkin instansi,3
pajak bea cukai diperiksa,3
bayar pajak dimakan tikus,3
pastisampai jumpa akhirat pajak,3
oknum pajak orangnya maling,3
wajib tindak oknum pajak jera,3
hmmm serem ketemu pajak,3
perampok berkedok pajak,3
rekam grombolan pajak ngukur tindakan slanjutnya,3
uang pajak hutang negara berkurang nambah bayar diakherat,3
ditawarkan spy bayar pajak,3
namanya indonesia wkkwkw pajak,3
pajak pesta pora,3
uang pajak foya foy petugas pajaksegitu miriskah negara,3
pajak senenge korupsi,3
pegawai pajak klu in,3
pajak jalan lobang trotoar hancur lampu jalan rusak lampu sepadan pajak,3
tukang pajak butuh duwek,3
bandit berdasi kantor pajak,3
pajak klu kompas mrk,3
noh cita laki menantu pajak,3
pajak daerah pajak djp,3
negara konoha berani jangn takutkalau benarkalau takut bodohinapa pegawai pajak,3
bayar pajak ngoyak uber maling maling pegawai pajak,3
ayooo bayar pajak bayar utang negara rakyat kena prank,3
rakyat bayar pajak dikorupsi pejabat,3
dirjen pajak hahahah beli rubicon yaaa,3
jual pajak untung,3
enak pemungut pajak,3
pajak raya koyok gayus tambunanlingmaling,3
pajak uange masuk negara kantong miskin ttp rugikan negara,3
pantesan pajak staff beli mcmga dg gajix,3
bnr mak bgtu pajak ngejarx mling pajak,3
klu presiden pegawai pajak pecat ganti,3
pidio mak piralka laporkan presiden pajak modus cari duwit,3
pajak senengane harga tanah kena pajak besr,3
pajak mahal bikin pengusaha malas bayar hitungnya omset kotor hrs laba bersihitu kenalan pajak,3
gausah bayar pajak,3
pegawai pajak rampok,3
dirjen pajak ri ukurannya pengawai pajak ngemplang pajak konsultan pajak,3
serba salah mmgga byr pjk blg bkn warga baiktp bayar pjk cm kantong pejabat pajak,3
wajar kerja pajak gajinya gede mainnya,3
pajak maling ngurus sertifikat bayar ngurus ulang bayar lucunya aparat desa membantu,3
kenape pendoponya tolong pajak menjualnya gruyonnn aeeejak pajak,3
pajak rubikon dongups,3
eropa bayar pajak uangnya makmur sejahtera indonesia bayar pajak uangnya korupsi pejabat,3
dikejar pajak miskin dikejar kebutuhan hidup pusing,3
pengen bangsat oknum oknum pajak bayar bayar korupsi oknum bngst,3
pajak peralihan bphtb validasi bkd lolos bayar pph pajak penjual,3
pajak dak bayar pajak korupsi,3
pajak gelap akh petugasnya nggk bayar pajak,3
beli pajak herang,3
buk pajak arti palak cuman ubah j l berdasi,3
pegawe pajak malingbukan maling,3
pajak kepingin uangnya,3
bubarkan kantor pajak,3
pajak ngiler rubicon ngoyok mae,3
ora gumun karo pajak bantul,3
kemurahan pajak itung pendoponya,3
petugas pajak makan otak isinya uang uang doank kaliya,3
oknum pajak perampok nyasudah kaget,3
permainan soimah temen suka ngukur kerjaan gedein pajak kasih amplop turunkan pjak,3
direktorat jenderal pajak ri ngisen,3
pajak kayahasil koropsiuntuk kasih makan anak istri,3
dirjenpajakri kemenkeuri nagih pajak nagih maling kocak kocak,3
kerja pajak harta bayar pajak ampe rubicorn gaya elit bayar pajak sulit cuakszz,3
pajak nga bayar pajak korupsi pegawai bermasalah,3
aah or pajak males bayar pajak motor males bayar mendingan beli beras kenyang lihat mobil roboco,3
alasan pajak uang uang distor negara,3
pajak sndri bayar pajak ditambah korupsi fvk oknum pajakkk,3
gila pajak berkah uangnya bangkrut pajak serba diuangkan hrgnya masuk akal,3
pajak gituuangnya dipakai,3
direktorat jenderal pajak ri benr,3
mugatsi nek ndelok pegawai pajak mesti sugihe,3
oknum pegawai pajak kuri kuri ky ngemis,3
pajak pungut pajak koyok oyak oyak maling lha pegawai pajake akeh seng ora bayar pajak savemaling,3
pajak suaranyaaamaluuu,3
mafia ituorang pajak,3
minimum pajak minimum njop bubukan egk percaya,3
wkwkwkwk pajak pajaklawak,3
bayar pajak masuk neraka,3
pajaknya bayar pajakmkanya pajak,3
rakyat bos gaji eh babu bayar pajak beli robicorn sempet korupsi,3
mafia pajak bgst,3
jual langsung pajak nyakan simpel,3
bobrokny pegawe pajak negri cuih,3
bajingan oknum pajak ngalami,3
nemenin spv bayar pajak perusahaan uang segepok amplok coklat pajaknya balikin juta spv,3
biasalah indonesiabeacukai pajak imigrasi polisi oknumnya mafiamafiamakanya indonesia kesenjangan sosial,3
menghindari hindari pajak ngapain rajin bayar pajak inget rubicon,3
depcolektor pajak,3
pajak liat bangunan elitekejaaaarrrrrrrrrrrr,3
pajak bangsat ngemis berkedok pajak bajingan,3
pajak gede kmakmuran merata uda menir belanda cuk pajak bilang kewajiban pelayanan bobrok uang negara rakyat,3
kui pajak opo preman gae soro menungso,3
pajak prcaya coz kbanyakan pembeli mnurunkan harga beli pajakgw salah,3
sepakat instansi perpajakan dibubarin isinya memeras membayar pajak,3
bpk peminpin periksa pajak,3
ush bayar pajak hidup cari makan tinggal dirumah turun menerun rumah perpajakan,3
bayar pajak hasil kerja pajak tinggal pajak,3
stop bayar pajak uang,3
mestinya pajak penjelasannya perihal,3
cek teman tetangga pegawai pajak ivestasi tanah dimana,3
puas maki pajak pegawai pajak geger awak,3
bayar pajak telat didenda jalan rusak dibiarin,3
pajak butuh uang kere,3
bayar pajak sedekah ketempat ibadah fahala mengalir,3
penake dadi pajak tinggal tarik,3
pajak bea cukai wow,3
pajak beliin anaknya rubicon mae uber uber bayar pakek,3
pantesan pegawai pajak,3
denger pajak denger ap,3
pendopo bayar rumah permata hijau bayar sebulan rbu hebat pajak,3
byr pajak cookk harga byr pajaktoh kendaraan byr pjk hrga turun,3
cerita me berfikir pajak pemalak yak maeee,3
malu tukang pajak makan keringatnya cuakssss,3
pajak dpr cuman sampah,3
direktorat jenderal pajak ri males bayar pajak cuaks,3
bagus usa bayar pajak,3
pajak bayar pajak rebu,3
pajak uangnya amanah efeknya segan bayar pajak,3
kenyang pajak fix cita kerjaan,3
pegawai pajak preman,3
anggota dpr dpt curhatan dri pajak bnyk pajak motor debat mahmud denger,3
pegawai pajak kerjanya,3
semenjak rubicontol uda males byr pajak,3
rombak habis pajak,3
pajak emng maling emng,3
koruptor berkedok pajak,3
pengusaha fokus ngomset nga pembukuan keuangan pajak ujung duitnya bocor parah bcr denda pajak,3
oyak bayar pajak giliran petugas pajak nunggak pajak ll,3
kpk tuhh liat kelakuan tukang pajak,3
tnya kerja pajak berkah,3
pajak preman sesungguhnya,3
bandit bandit pajak dimana ditangerang pie,3
bayar pajak memperkaya pegawai pajak negeri konoha,3
mampuslah masyarakat percaya pajak mampussss,3
pajak bayar pajak pajak ditangkap kasusnya hilang ngeri indonesia,3
tukan pajak lawandi situ uang situ korupsi enak,3
ush byr pajak kenyang perut pegawai pajak,3
pajak bayar pajak bales duek ojok melbu kesakmu lo yo,3
makmur petugas pajak lahan basah rugi negara pejabat senang korup tiada peduli,3
direktorat jenderal pajak ri percaya pegawai pajak,3
golek beli rubicon ituparah moral pajak,3
kerjaan orng pajak cri makanan,3
masuk surga mengambil pajak zhalim hr abu daud no,3
sekelass artists aj ditodong pegawai pajak rakyat,3
beli rumah digituin kantor pajak,3
bayar pajak seriusnanya,3
ush bayar pajak pajak bayar pajak uang pajak disalah gunain,3
namanya pajak kekayaan hadeh pajak,3
hahahapodo kisahku mak membayar pajak transaksi ndk mbuh kono,3
indo maju ngurus uang pajak rakyat kudu dipindah zimbabwe,3
bayar pajak kecuali pajak motor,3
bayar pajak tar dipake beli rubicontol,3
pajak cepet bayarsedangkan bayar pajak,3
kya dirjen pajak gto ngerasain,3
dirjen pajak maling soimah,3
herman real kelakuan pajak,3
uang pajak poya anak kluarga,3
nama bayar pajak setara rumah btn subsidi,3
direktorat jenderal pajak ri beli rubicon pakemang rubicon kemarin kapok,3
dirjen pajak ri sipaling oknum,3
kabarnya rumah denny caknan tuhaman dennycaknan dri pajak,3
pajak mafia koruptor,3
kasihan rajin bayar pajak bayar koruptor,3
bayar pajak gengsi stop,3
gayss didesa bayar pajak bismilah didatengin,3
pajak dlltp aneh negara rugi,3
gausah bayar pajak beli rubicon wkwkw,3
pantes pajak tajir penghasilanya dri bgituan,3
maling pajak pajak,3
pajak bayar pajak lawak yaaa pajak mahal eh diatasnya kaga bayar pajak,3
bayar pajak rampok indonesia pentinggi so terima rendahin,3
pegawai pajak bicara,3
polri dpr dirjen pajak haduh kampus kehilangan kepercayaan masyarakat,3
males byar pajak,3
dirjen pajak ri bikin harum,3
bayar pajak bikin raya,3
bayar pajak korup bayar pajak fasilitas publik sdmnya bgst,3
pajak zalim teguran swt,3
pajak jual beli rumah masuk pemda pajak negara pegawai pemda wooyy,3
pajak isinya maling,3
dirjen pajak ri kaesangpangarepofficial drhotmanparisofficial kpk sekretariat presiden,3
pajak sifat sikapnya rafael maling,3
motor mati pajak bodo dahnegra bobrok korupsi males,3
harga kalkulasi harga rumah pegawai pajak smpe,3
pajak ngoyok suru rakyat bayar pajakmereka bayar pajak ndak,3
ayo kpk cek pegawai pajak ngoyak dpr,3
bayar pajak mensejahterakan pajak donk kt,3
spil wajah petugasnya narik pajak make soimahpencawatireal,3
bayar pajak uangnya masuk kantong og celeng,3
keren pajak konoha,3
bayar pajak yaaa maaf nanya,3
pajak ganti zakat berkah,3
pegawai pajak uangnya berkah kasian benih benihnya,3
pajak jalan rusak,3
oknum pajak bgst,3
pajak mh kya kya anjirrr,3
pajak emangnya taat bayar pajak serius nanya,3
maklum makk bergayaa pke uang pajak,3
pajak mahal beli robicon,3
tetangga pajak sukses,3
prnah bayar pajak kntol sma pajakenakin awak mati an nyarik duet enak x,3
anjirr pajak pajak segitu kah aslii malu cok cok,3
oyek pajak dp rubicon,3
gunanya pajak apaansihkita krja mlah bayar pajakmerugikan,3
pajak bangsaaaaddd,3
direktorat jenderal pajak ri beli rubicon lahhh yegasi,3
dirjen pajak ri dengar,3
direktorat jenderal pajak ri urusin anak buah,3
pajak pengen rubicon,3
dirjenpajakri kemenkeu ri direktorat jenderal pajak ri,3
urusan notaris pegawai pajak beaya bikin akta hitungannya melibatkan pajak,3
direktorat jenderal pajak ri anak buahmu piye to riii,3
pejabat pajak gag enaknya,3
udahlah kasih negara ama tukang pajak,3
males bayar pajak bikin,3
nyuruh bayar pajak sapa jalan berubah,3
direktorat jenderal pajak ri main kelen,3
tikusnya pindah posisi rumah pajak,3
pajak dengerin telinganya baek lo korupsi uang bayar pajak,3
buka coffee shop pajak ohh layanin,3
bubarin dirjan pajak kejam pemalak,3
pajak motorku mati mbok es benn timbang dadi uang panas,3
bahasa pajak kmaren bima cma infrastruktur lampung dajjal smpe maki maki pajak,3
smenjak pamer rubicon motor mati pajak bodo,3
direktorat jenderal pajak ri beli rubicon brp rencana,3
pegawai pajak gaji gede cari celah,3
datengin pajak pajak air tanah mikir ceritanya pajak air tanah setauku pajak air tanah perusahaan gede,3
dipatok pajak ribu sebulan sebulan dapet juta banter,3
nampak pajak ketar ketirr,3
pajak bayar pajak kah,3
hati oknum urusan pajak pinter kena genjotannya teliti,3
bayar pajak biayain rubicon,3
direktorat jenderal pajak ri eh kepencet,3
tanteku ngurus pajak tanahnya diribetin ktnya beli murah tanah ngasih harga segitu,3
soimah target operasi pajak,3
oknum pajak gituu,3
pajak bikin nentuin segitunya kah pengen cepet nilep uang,3
harga pendopo ditaksir pajak bayangin uang slisih pajak ambil setor diambil nilai,3
bayar pajak nyumbang pemerintah,3
oknum pejabat pajak bagng rakyat bayar giliran bayar stop bayar pajak,3
kadang beli motor males bayar pajak,3
ditjenpajakri percaya pajak rakyat bayar pajak ehh pegawainya pajak bayar pajak,3
miris dibatam rumah bayar pajak x trs tanah hak milik hak pakaisya heran,3
pengertiannya pajak target beli rubicon loh,3
dioyak oyak bayar pajak foya foya pegawai pajaknya beli robicon beli harley,3
hahaha pajak ngibulin tolol,3
kdg gamau byr pajak liat pajak dibayar memperkaya,3
cerita pajak rumah emak bayar bukti pembayaran mak pajaknya besok ntar,3
diurus langsung emak kantor pajak,3
cari kerja jungkir walik cari order dpt orderantender bayarnya pajak gileee untungny lbih banyakan pajak,3
rakyat indonesia bengek byr pajak memprkaya pajak n kluarganya sprti bpknya mario dandyemaknya hedoncapekk,3
pajak klarifikasi,3
pajak perampok sesungguhnya,3
memeras masyarakat gaya petugas pajak,3
pegawai pajak atr bpn bappenda pemda diy pajak pajak daerah dikelola pemda,3
ayoo artis lainn konfirmasi pajak ketar ketir pemerintah budeg,3
gertak uang langitspy kena tar pajak,3
ketar ketir oknum pajak,3
apus pajak bayar,3
direktorat jenderal pajak ri ora ngutekkk,3
yeee malu pegawai pajak kocak,3
pajak jelong ln mak,3
kebongkar mainnya pantesan petugasnya dirjen pajak ri dirjen pajak ri,3
pajak ngoyak ngoyak makan,3
bgtt kmren saudara meninggal eh siangnya dpt surat pajak dri kntor posdisitu tertera alm kena pajak jtan krena mobil,3
to bangun rumah lahan bayar pajak,3
rumah juta mata pajak milyar mata bank juta,3
instansi perpajakan tugasnya memeras bayar pajak hebatkan,3
wajar kerja pajak semuamakan uang haram,3
pajaknya gajinya dri pajak,3
ayo kompak semuagakudah bayar pajak bayar pajak memperkaya pegawai pajak,3
kompak bayar pajak indonesia,3
salahkan rakyat bayar pajak lihat kelakuan oknum oknum,3
pajak audit ketat,3
npwp surati nunggak pajak pajak potong kantor tertera slip gaji,3
mampir kantor pajak tangerang eh buset bentak sumpah kesel petugas nys,3
taksirannya pinter pajak dasarnya uud,3
pajak sales nyarik target mulu,3
habis dirjen pajak langsung posting kekayaan,3
podo kyok dipihak pajak belinya harga pajak,3
harta sesak nafas gara pajak,3
pajak merasakan pekara beli rumah pajaknya ugal ugalan,3
maktukang pajak golek tambahan sampingan,3
kerja staff pajak capek jenis biaya kena pajak peraturan gonta ganti,3
direktorat jenderal pajak ri niihhh,3
pantes pajak utang negara ajeg,3
artis sprti pekerja cari uang lelahorang pajak j cari uang,3
kbr thr potong pajak lbu tahuna potong pajak kecuali gaji bulanankok,3
mae membuktikan kantor pajak,3
pegawai pajak korupsi tok,3
oknum pajak ne diperiksa,3
heran dunia pajak,3
bayar pajak gmana,3
usut tuntas pajak kecekel kabeh koyo rafael tri sambodo,3
rajin bayar pajak uangnya beli rubicon,3
pantesan pajak ra enek seng kere,3
samaaaaaaorang tuaku bget orng pajak bpn,3
parah pgwai pajak mksudnya cb bertindak sprti,3
rumah harga makan dirumah makan pajak,3
pajak percaya siksa kubur,3
kui oknum kudu proses sinyalir pajak,3
jgnkn riset kantor pajak aj ehh ksik ribu kluar,3
malu maluin pajak astaghfirullahheyyy kenapaa hah,3
gausah bayar pajak ajalah,3
pajak berbenahlah sperti kai,3
halalkah uang hasil narik pajak dikasihkan anak istri keluarganya,3
netizeeennn tunjukaaann kekuatan muuuuu spil pegawai pajak nyaa,3
pegawai pajak tutup kuping,3
direktorat jenderal pajak ri ngebet pengen cepet beli mobil,3
soimah mengarang cerita tv gilaaa percaya masyarakat pajak neh,3
lha yo ngoyak kon mbayar perlune lak bayar uang gawe foya anak bojone tuku tas ratusan juta jln negri bayar pajak kerjo rekoso,3
tolong kpk serang pajak,3
catat namanya nitizen pajak dicecar pakai mobil anak sekolah dmn kekayaannya brp,3
direktorat jenderal pajak ri ediaannn,3
yo iku asline oknum pajak aslinya okeh uang songko meres masyarakat hukum,3
kode keras direktorat jenderal pajak ri,3
aneh pajak numpang indonesiakayak tanah milik diarupa masuk perut anak istri uang haram,3
bayar pajak pegawainya beli rubicon,3
ampe segitu nye bertahan hidup pajak,3
okb kayanya sasaran empuk pajak kasian berjuang eh nikmatin pajak,3
semenjak kmaren percaya lgi bayar pajak,3
lupa bayar pajak beli rubicon mlas bayar,3
uang pajak larinya lari anak mario,3
direktorat jenderal pajak ri laen mabok rubicon,3
pajak btw no pajak,3
keliatan bobroknya pajak,3
capek ngumpulin uang bayar pajak mainin oknum,3
hasil nyr pajak dinikmatin anknya,3
pajak mandang harta kebalikan bank yakk,3
direktorat jenderal pajak ri akun ditag nongol,3
cepetan bayar pajakk laahhh istrinya mnta mobil tas baju kumpulin dana scpat mngkin bayar pajak mngkin,3
pajak lulusan stm jurusan bangunan ilmu pendidikan ttp diterapkan dipekerjaan,3
pajak menetapkan hrg pendopo brrti departemen pajak tugasnya tukang bangunan,3
pajak bayar utang negara yaj orangnyaa,3
bangganya dg petugas pajak negri ininegri hancurnurani pejabat bobrok,3
periksa pajak pajak,3
gaji suami bayar pajak pengeluaran sebulan nangis liat slip gaji ikhlas pdhal keperluan pendidikan anak ketar ketir,3
tanggapan blg klu byr pajak tinggal diindonesia,3
ngalamin stiap thun byr pajak ttp bilang tunggakan,3
kejadian ngurus pajak nama pph bphtb,3
beres aromanya ntr rakyat kismin telat pajak uda sangsi dih,3
halloo direktorat jenderal pajak ri rakyat dikejar pajak bayar pajak,3
milyar jejeli mulut pajak skalian kenyang,3
bkn pajak pencuri mengatasnamakan pajak,3
pajak bphtb pph setau pajak pembeli masuknya pajak daerah bkad pajak negara dirjen pajak,3
pajak makan uang masyarakat melebihkan pajak masyarakat,3
thats why gamau bayar pajak kerja dipotong pajak,3
curiga pajak preman,3
kerja mati gaji bayar pajak,3
aparat dirjen pajak pegawai bumn kabeh podo podo remek ee kyok negriku,3
pajak jual beli harga pajak pajak nentuin harga letak tanah,3
salah lahan basah pajak memangcobalah perhatikan pajak rumahnya bagusduitnya banyakayo buka boroknya,3
gausah bayar pajak plis,3
uppp pajak pajak,3
dirjen pajak ri binasa,3
direktorat jenderal pajak ri malu,3
kecewa pajak taat bayar pajak denda aset terdaftar,3
licik maksa masy bayar pajak,3
bubarin kantor pajak,3
pantesan pegawai dinas pajak terkenal gajinya,3
gara vt pajak nyenyak tidur,3
pajak meresahkan bun,3
males bayar pajak uangnya hbis comotin mulu,3
berterimakasih ag kebobrokan dirjen pajak blow,3
intinya petugas pajak kasih contoh baikdan imey warga negara indonesia,3
pajak paham itungan keknya,3
iki nek sepakat indo bayar pajak pajak dibayar rakyat pajak melebihi rentenir,3
untung ketangkap suka makan uang pajak,3
bayar pajak pegawai pajak beli barang mewah,3
oknum pajak preman ngejar wp bayar pajak tertib bayar pajaknya,3
sory percaya pajakkta bayar pajak nnti uangnya hedon anak,3
rempong berurusan kantor pajak kezaliman berlindung undangundang,3
yukdaftar pegawai pajak bea cukai guysss,3
bubarin pajak ngeri,3
bner motor pajak mati thn,3
pengalaman bayar pajak sawah eh ditagih bayar lagimana ngeyel petugasnya,3
negara pajakmkn kena pajak bli barang kena pajakpup kena pajak,3
pegawai pajak kayalebih depkoletor,3
dispenda pajak dimana daerah garang djp ikutan,3
lawack kaliannnn direktorat jenderal pajak ri,3
kerja notaris ruwetnya pajak,3
smakin percaya pajak,3
pajak target minimal pemerasan kah,3
bayar embat petugas pajak,3
pajak pajak pajak ush byar pajak,3
pegawai pajak kui maling mak,3
pajak ngungkuli bakul pentol pengen haji,3
bongkar acak kekayaan pegawai pajak enakan rakyat rusuhin,3
orng pajak periksa harta aneh pngen pres orng byar pajak jgan smpai pra pgwainya prnah byar pjak asuu,3
direktorat jenderal pajak ri masya,3
cepet dapet rubicon direktorat jenderal pajak ri,3
mak kakak bayar penjual deal harganya notaris tembus pajak heganya sgitu,3
pendopo dibilang pajak senilai maku bilang bayar pajak berani bayar engak,3
lha cma jualan klontong ampe sesak nafas nyisihin bayar pajak mreka enak,3
masyarakat indonesia mengungsi negara serba pajakklo mmg pajak dialihkan pembangunan tolong prosesnya,3
bayar pajak pajak rubicon,3
ngitungi pajak harta teliti pajak tutup mata,3
rakyat mengkis byr pajak eh korup,3
pajak uang pajak makan ganti ajah ganti ngulang,3
sidak pajak semena kecurangan menutup korupsi,3
bijak bayar pajak slogannya pembayar pajak bijak pajaknya kah,3
ngeriih yakapa pajak,3
bilang ush bayar pajak ngeyel,3
hilang kepercayaan pajak direktorat jenderal pajak ri indonesia,3
direktorat jenderal pajak ri piye,3
isinya tikosss kdepanya berhentilah bayar pajak krena tikos mnjdi,3
pajak mmg gila rakyat bayar pajak untung miskin,3
bner bget beli tanah harga pasaran pajak percaya nama jual beli sor sma sor aneh pajak mmang,3
dirjen pajak ri ngawurr,3
males bayar pajak motor taat pajak,3
ayo bayar pajak makan,3
beli sawah harga juta mw nama tera seharga juta kena pajak beli pajak,3
negara hutang rakyat oyak oyak pajak bayar hutang negara,3
oknum pajak jujur mata duitannanti naudzubillahingat diakhirat,3
bayar pajak pajak pajakan,3
pajak kelaparan suee memalukan,3
liat joko widodo ri kelakuan dirjen pajak ri,3
emng percya ama pajak,3
pantesan pajak tajir targetnya,3
pegawai pajak rakyatnya diperas dpr pajak beres peninggg dpr ri direktorat jenderal pajak ri,3
bayar pajak uangnya korupsi,3
yo gampang srh pajak beli,3
ayo berhenti bayar pajak ayo benahi perpajakan sah bayar indonesia,3
ohh pajak daerah sihurusan pemda pajak daerah mbakkkk hadeuhhhhhudah koar koar salah,3
bayar pajak ujung beliin rubicon,3
pajak ditagih utang hasil pajak bayar anggota dpr kerja harga mahal uu mencekik masyatakat,3
bayar pajak tanah rumah habisnya cuman rebu bayar pajek pie jal salahe nangendi kaget,3
