komentarClean,cluster
oknum pajak oknum beacukai gitusekarang rame ntar ilang berita,3
kerja keras yokkkbiar krywn pajak rubicon moge,3
ndak bayar pajak,3
gaji umr lapor pajakeh pejabat pajak lapor kekayaan terbaik negara,3
bebas pajak kyak,3
masi maw bayar pajak,3
sampek paham ap uang pajak,3
oknum pajak sayang agnes bocil cantik bikin oknum tidur,3
untung bayar pajak selamat uang,3
rakyat bayar pajak hasil keringat,3
bayar pajak motor mikiriiin sebulan jatuh tempo telat kena denda liat liat lgtggal habisnya pajak,3
masi membayar pajak,3
no pajak pajak club,3
pantesan pajak taun ribu lokasinya,3
iku gek pegawai pajak dorong liyane,3
bayar pajak pegawai pajak makmur gaji rakyat bayar pajak kemakmuran pegawai pajak,3
untung perna bayar pajak,3
gx byr pajak lgi,3
ironipajak pajak pajak pajak pajak pajak pajak pajak,3
pajak bonusan thn digit loh ikhlas sumpah ikhlas hhi,3
bayar pajak makan x sehari,3
wajib bayar pajak,3
bayar pajak motor mio,3
bayar pajak ribu motor honda vario pegawai pajak motor moge,3
tertiblah bayar pajak tertip hidup,3
males bayar pajak negara pajak rakyat negara pemerintah ketat bantu rakyatnya,3
khusut pegawai pajak,3
pejabat pajak raya,3
turun gaji pegawai pajak,3
setop bayar pajak,3
aneh pegawai pajak uang,3
dirjen pajak bea cukai imigrasi bpn kong x kong guyssss,3
stopbayarpajak direktorat jenderal pajak ri,3
rakyat byr pajak,3
serentak me bayar pajak,3
kebayang klau rakyat indo kompak kaga bayar pajak gmna meraka,3
kompak ja byr pajak,3
assiiikkkk untung pajak,3
bayar pajak raya,3
setau gaji pegawai pajak renumerasi ngaruh,3
tempatku pegawai pajak istrinya istri rumah,3
dirjen pajak dirjen lgapa dirjen,3
pegawai pajak hidup harta berlimpah rahasia,3
menteri keuangan rajin membicarakan perpajakan apapun dijadikan pajak eh taunya bikin pegawai pajak,3
ayo ramerame bayar pajak,3
telat lapor pajak bulanan denda ribu,3
kendaraan telat bayar pajak taun blokir bebas pajak,3
byr pajak kt beli beras bsyak,3
audit pejabat pajak,3
dicek motorx jngan telat pajak,3
kerja ngumpulin uang ribuan berhari kadang ngantuk bertahan hidup bayar pajak,3
bedanya zakat pajak,3
nyesel bayar pajak kalou bayar pajak takut dihapus,3
bayar pajak pegawai pajak hidupnya hedonisme,3
dirjen pajak hidup mewah,3
pkonya lag bayar pajak titik,3
pajak doangpejabat gaya hidup mewah,3
pajak mkn pejabat,3
bayar pajak gayus menterikeuanganindo,3
ngapain bayar pajak,3
sj dikirim petugas pajaksuruh lapor pajak tahunankalau lapor didenda,3
gerobak bakso roda kena pajak tolong pencerahannya bpak dirjen,3
dirjen pajak main moge,3
males bayar pajak gada uang,3
mikir tuk bayar pajak,3
pajak miskin zakat miskin,3
pajak khusus rakyat indonesia bebas pajak tanggung bapaknya mario lumayan,3
nggk bayar pajak,3
besok maret lupa lapor pajak,3
diusut disamakan pegawai pajak dg pns,3
hentikan membayar pajak,3
simple lakukan audit masal transparan pegawai pajak,3
rakyat bayar pajak semtara hidup pejabat hedon,3
pengusaha pegawai pajak,3
bayar pajak murah atu ribu motor vario jangn ribu,3
hadeeh pajak pajak,3
penghasilan menentu bayar pajak diatas telat didenda,3
kaga bayar pajak,3
telat bayar pajak,3
stop bayar pajak s,3
jualan celah pajak jualan celah hukum negeri konoha,3
kerja pajak hidupnya makmur tujuh turunan bebas pajak,3
pajak kementerian keuangan audit,3
ohh dirjen pajak ri klub motor,3
pajak susah payah bayar menikmatinya,3
oknumnya bayar pajak oknum hy kpk ud turun tangan,3
pastikan bayar pajak buuu,3
audit pegawai pajak,3
telat suratin pajak,3
motor supra taat bayar pajak eee mboh,3
pajak pajakkompenikompeni,3
pegawai pajak th kerja pakai kendaraan mewahkerena banyaknya pengeplang pajak,3
nggak taat pajak,3
pegawai pajak brooo senggol donk,3
kantor pajak konoha,3
pajak kayyaknya pejabat selidiki,3
apalah rakyat jelata tauny bayar pajak pajak pajak,3
australia singapore usa pembayar pajak uda ber umur th pemerintah bayar rakyat,3
gerakan anti pajak,3
uang pajak masuk kantong pejabat kaget,3
titip pesan dirjen pajak bayar pajak,3
gakusahbayar pajak kecukapan idup aj uda syukur,3
zakat pajak zakat dibrikan miskin pajak peruntukkan sikayasemua jenis brg kebutuhan rakyat berpajak,3
mestinya rakyat bayar pajak disejahterakan pegawai pajak bonus,3
merevormasi gaji pegawai pajak isentif,3
rakyat bayar pajak,3
untung bayar pajak,3
motor moge byr pajak,3
wowkwowkwowo direktorat jenderal pajak ri,3
polisiderjen pajak instansi,3
ternyataselama bayar pajak,3
masikah bayar pajak,3
enak pegawai pajak hidup mewah mewahbagi tips,3
ayo bayar pajak kemakmuran pegawai pajak,3
klupnya kesulitan pajak lancar suap,3
pegawai pajak itukita taat bayar pajak kasihan pegawai rubicon,3
bebas bayar pajak,3
jadii raguu bayarr pajak,3
pegawai pajak bayar pajak,3
cek kendaraan barang barang pejabat pajak bayar,3
pajak bebas dk usa bayar,3
pegawai pajak hidupnya mewah mewah,3
kah libur bayar pajak,3
udeh kg peevaya byr pajak,3
ayooo byr pajak pegawai pajak pny moge,3
heran pegawai pajak hdp mewah,3
orng tua jlnx pincan reok mkn laut sakin takutx bayar pajak,3
motor bebas jalan bebas pajak,3
peras rakyat dg pajak mafia pajak hidub mewah kropsi duet pajak sebenar kpk wajib siasat mafia pajak menteri aparat tilang jalan,3
asn dirjen pajak moge rubicon menkeu naikkan mcmpajak,3
tolak bayar pajak,3
denger direktorat jenderal pajak ri,3
efeknya sampek rakyat ogak pajak,3
uang pajak bayar,3
pesunann bayar pajak telat taku denda,3
pegawai pengusaha bkan peg pajak sj,3
mari taat pajak pejabat beli rubicon,3
ironi bayar pajak makan mie instant dibayar pajak makan ramen mewah,3
rakyat haruskan membayar pajak pegawai pajak hidup mewah rakyat menjerit ber hura,3
pegawai pajak instansi,3
pegawai pajak parpol usaha jarang bayar pajak,3
pajak negara pajak pejabat,3
periksa pegawai pajak,3
mario pahlawan bongkar penyelewengan pajak,3
taat pajak motor supra tukang pajak harley,3
masyaallohpegawe pajak,3
mogenya diusut dirjen pajak bersih rakyat dibebaskan bentuk pajak,3
jualan sepi siang malam jaga toko capek ngantuk pajak penghasilan bayar,3
pemutihan dihapus pajak persulit pajak kendaraan yng nunggak bukti pajak bangunan tanah yng,3
kalu rakyat stop pajak mna buk,3
mbayar pajak didenda,3
copot suryo ditjen pajak,3
jngn lupa byr pajak,3
mio ttp bayar pajak muk ngelus dodo delok brita iki,3
oknum bajingan suka makan duwet pajakkita uber bayar pajak duwitnya hidup mewah oknum bajingan pegawe pajak,3
kerwn petugas kantor pajak pindah kntor pajak,3
moge bayar pajak,3
seharus pajak disesuaikn orng tdb,3
tunjangan pegawai pajak hilangkan stop bayar pajak,3
masarakat pagawe pajak masarakat bayar pajak,3
klu kya byr pajak,3
miskin ttp setia bayar pajak,3
uang jugammbyar pajak,3
tolong periksa pegawai pajak karawang pliis rmh mewah n rumah omg kesian yasebagai rakyat,3
rakyat rajin bayar pajak membiayai gaya hidup mewah pegawai pejabat pajak paraaahhhh,3
ayo bayar pajak pegawai pajak moge rubicon,3
pegawai pajak sepeda gayung kantor,3
