komentarClean,cluster
samsat bayar pajak buka jam seninjumat spanduk no calo pdhal calo nongkrong disamsat diem aj,3
gaji pajak dibayar rakyat,3
dibikin sistem alfa gaji pajak negara,3
pegawai anggaran mahal ntar pajak,3
pajak digenjot gilagilaan,3
bayar pajak pelayanan buka kerja v mentalahkan bayar pajak susah,3
bayar pajak gaji mrk maaf kesinggung terkadang hrs cuti dl urus surat terkadang pungli,3
stuju buka sore malam kerja maaf bayar pajak nggaji kerja pemerintah,3
mw bayar pajak kendaraan bermotor aj jam siang layanin,3
emng bner kya byar pajak ja habis stngah ngurus ja,3
mall pelayanan publik disitu ngurus kependudukan ngurus bpjs pajak,3
berasa spt payah uang pajak,3
buka jam biaya operasional ntar pajak protes,3
urusan birokrasi bikin darah qta butuh mrk gaji negara pajak bebankan rakyat,3
tupoksi sma shift berbeda kantor pelayanan khusus enk samsat pegawai urusin perpanjang pajak,3
pajak nomor pelayanan publik nol,3
jam ngurus pajak disamsat pekanbaru jam closing wkwkwkw senin jumat,3
ajha ujungnya percikan nua potong pajak cair,3
dibayar pajak jgan tingkah,3
lupa byr pajak jalan,3
uang pajak buar gajih dpri duitna pssi kontrak sty,3
bukn mario dandi bikin malles bayar pajak menyaksikann berasa sakit hati,3
lewatnya ampun motong uang pajak gercep,3
pajak elite bnrin jalan syulitt wkwkw,3
pemerintah masyarakat menyadari pajak penggunaan dana pajak,3
jalan perbaiki mogok bayar pajak kabupaten lampung,3
heran uang pajak wajib bayar pajak perdesaan jalan garinjul bolong,3
bayar pajak jalanan layak stop pajak serentak,3
pajak elit jalan bagus sulit,3
audit harta kekayaan petugas pajak bea cukai,3
kebanyakan pajak,3
pajak pajak pajak pajak pajak,3
pajak diharus gpp janagan kasian tkw bawa,3
mengeluh bertugas resain beres tarik pajak siluman,3
pajak bea cukai kacau,3
maaf barang kena pajak jugakami perantauan pulang bawa keluargacontoh coklat milo buah,3
coklat bayar pajak gimanatlek,3
bawa coklat ribu diembat petugas bayar pajak juta hadeuhh,3
bea cukai sarang pemalak namakan pajak uang masuk kantong,3
ne bawa tembelek kena pajak ndak,3
setahuku barang nilainya dolar kena pajak secend kena,3
buk sri mulyani cuman cek lapangan pegawai pajak bea cukai bandara pemerintahan pemda bajingan,3
sxan pengiriman cargo bayar pajak bobol,3
ginilah negara pemasukannya cm pajak,3
pajak bea cukai mestinya warga negara warga gigit bea cukai rampok rakyat,3
rafael percaya pajak beacukai kumpulan perasaan,3
beli buah ringgit aj kena pajak juta,3
begimana bawa snack dibawah kna pajak,3
bea cukai ri pajak elit pelayanan turu minus,3
acak adul mintain uang barang mesti kena oajak knpa hrs kena pajak jgperaturan ituuang pajaknya kemanain,3
pokoknya dihapus biaya pajak tkw tki bulanan bea cukai argo,3
bawa jajanan thailand belanja juta an kena pajak masuk volume,3
pajak brenti kau,3
jujur kirim barang takut kena pajak takut barang bnyk hilang cuti pulangpun takut pajak hp pajak barang,3
siang malam tugas wooy kerjaan loe x rakyat bayar pajak ngasih devisa negara cuukkk,3
bayar pajak beacukai ehhh barang ambil uang haram makan mengerikan,3
gaji bea cukai ama pajak pling gaji pns,3
artis artis suka pergi jalan negri beli barang branded kena pajak,3
direktorat jenderal pajak ri,3
benas pajak nilai usd sri bikin simpel ribet ujungnya bancakan oknum,3
stop bayar pajak thun,3
berak enda pajakjadi kt hidup negara sedikitdi pajak,3
hoekkk elaahh belanja baju abby smpai dollar kena pajak,3
buk tolong tkw utamakan kt byr pajak bnyak seenak main ambil barang tkw,3
namanya jajan cikhi mintai pajak,3
piala juara nyanyi pintain pajak mmng rakus oknum petugas bea cukai,3
alah pinter memeras tki barange pajak i,3
mf barang tkw kebanyakan baju dh lusut j makanan coklatpun diambil pajak byar,3
sarang maling paket negri bayar pajak masuk obrak abrik barang maling parah oknum negri,3
uang hasil bayar pajak uangnya,3
box bln disita kena pajak dikirim kerumah,3
bikin online berani rumus pajak baku dinego manual,3
pekerja tkwtki bawa barang dipakai dikenakan pajak,3
korban srimulyani bayar pajak uangnya klw kupul korupsi,3
tujuannya cari barang pajak isi kantong,3
seharus layani devisa negara pulang negara pajak,3
stop bayar pajak terbaik rakyat babu pejabat,3
pajak masyarakat besarkan biayanya sdg mreka bebas pajak,3
melayani pajak piala sri mulyani,3
baju bekas kenal pajak,3
gaji bea cukai sich smpai ubek brang pra tkwsgala macem kenakan pajak,3
pajak tukang makan uang rakyatrakyat kejar srh byr pajak duitnya embat,3
garangsementaraaa mafia benefits pajak meblooonin rakyat,3
nanya kemarin paket london bayar pajak bea cukai ayu,3
pajak masuk sapa kantong sapa,3
ce kirim baju bayi harga nt kirim pos rumah kena pajak ribu lbih pegawai indonesia srakah,3
ngakak gowo coklat isih kon pajak,3
direktorat jenderal pajak ri kemenkeu ri bea cukai ri dengar curhatan asli,3
temen singapura hp kena pajak kta tmn tkw singapore,3
bawa kena bayar pajak wkt bandara jogya ribu sma orgnya bayar hrs bayar pajak pesawat,3
iso hp larang iku lungsurane juragan mosok kenek pajak maneh,3
denger pejabat bea cukaidan pejabat pajak,3
la iku bojone pejabat blonco ndek negri keno pajak ora,3
ganti pegawai pajak n bea cukai masyarakat percaya,3
mangan pecel wae bayar pajak,3
barangku kardus diodol odol bayar pajak kemarin bayar jare lek dibayar gsk dikirim pulan ce,3
pajak oknum petugasnya,3
negara r i jatuh miskin sikit sikit pajak,3
bea cukai polis dn petugas pajak,3
lahbayar kasihinbayar pajak,3
takut viralnya piala bayar pajak,3
engah dikasih bayar pajak,3
tolong str rekomendasi profesi biayaya bayar pajak mobil,3
potongan pajak transparant mbt berkali ditanggapi kecewa,3
bercita cita dananya ayo pengusaha tertip membayar pajak,3
minimarket bayar pajak retribusi pemda harusan dapet perlindunganbackingan satpol pp ngusir ormas megang parkiran,3
lgsg sidak tangkap solusinya pemda narik pajak kewajibannya dijalankan,3
bukanya gedungperkantoran bayar pajak ato apalah namanya parkir konsumen,3
pekerja pulang malam solusi bayar pajak bayar kewajiban dipersulit,3
alfanya bayar pajak pemkot parkir,3
sewa mobil plus supir pajak nanggung yo podo wae,3
indonesiasama cari makansama bayar pajak kendaraan nyacostumer pnya hak pilih apaanbkn bgtu,3
uang pajak keluarga sisain jalan,3
rezita meylani yopi kementerian pupr thohir dirjen pajak ri,3
keren rakyat kena pajak pejabatnya gaya sultan,3
uang dikutip pajak kpk terjun langsung inhu,3
bayar pajak boss,3
ht hati masok lobang tuduh telat pajak hrs denda,3
emk th honorer gaji jtpertama x ngajar gaji ptog pajak ge pppk,3
otomatis pajak dibayarkan membangun tersentralisasi,3
pajak bayar tunjangan dpr menteri naikin gaji gurumaunya murah berkualitas ironis,3
seragam beliin pajak rakyat malu,3
islam masuk rga pemungut pajak takut,3
imigrasi cukai pajak lahan basah,3
oknum cukai pajak imigrasi parah,3
percaya direktorat jenderal imigrasi direktorat jenderal pajak ri seragam,3
mantul warga indonesia capek imigration pajak bea cukai malakin aj,3
imgrasi pajak beacukai taek banyk korup,3
kacung kacung bayar uang pajak negara suka bertingkah,3
pajak dollar mangkin,3
artissomeone else belanja branded ln lengkap apaiya bayar pajak liat soale,3
percaya sma plg bawa bumbu kena pajak kasih mrka mrka msk daging,3
bea cukai ri kirim makanan baju india senilai jutaan penerima bayar pajak bea cukai india,3
klw beli brg mahal lsg kena pajak,3
ribet serba kna pajak,3
harga ribu bayar pajak ribu piye jal blunder jal,3
maksudnya pajak ngitungnyq piye yo biaya pajaknya mahal harga belinya,3
wktu beli aj pajak beli tiket dab terbang pajak negri byr pajaktrs bw pajak,3
kakak belanja dibawa indo refund pajaknya negara gituu menyesuaikan aturan pajak negara,3
brarti ln jam tangan taro koper baliknya kena pajak wkwkkwkw,3
gantungan kunci kena pajak,3
males bayar pajak,3
anyway cerita tkw hongkong iphone byr pajak iphone beli indo,3
bwah juta knakan pajak jam tngan kena pajak,3
tas charles kieth kena pajak,3
kaka kena bisikan petugas pajak,3
beli jam tangan rolex belu negeri kena pajak,3
kalok kalok bawa kalung kena pajak taruh koper,3
pajak keluarkan brang bawa contoh barang baju harga ribu pajak juta hitungannya klw,3
klu beli jam tangan langsung pakai sj kena pajak,3
dolar kena pajak woow,3
seketat indo pajak nilainya konon pakta internasional,3
ngonfirmasi ezway bneran barang dipungut pajak apapun,3
mari belajar pajak br,3
nitip beli sepatu belanda kakak box lepasjadi kenak pajak,3
sabar pgn bayar pajak kas negara,3
langsung petugas pajak diinfokan hitung perkasus,3
bea cukai menduganya baju bekas kena pajak,3
nonton dl net kena pajak harga juta keatas dmana namanya pajak rendah harga barang,3
perasaan nonton srimulyani deklarasi barang usd kena pajak knpa beli makanan bayar pajak mahal,3
kiriman belanda kena pajak,3
bapaknya pacarnya sodaranya pajak,3
eh liat artis pejabat menteri abis ln bawa barang bawaan liat kena pajak,3
pajak maksimal harga brg harusnyakalo gni brg denda rugi boss,3
bawa koper isi sendal red apple thailand kena pajak pasang,3
bea cukai ri tandain paspornya dikenain pajak keknya,3
perhitungannya biaya pajak nilai barang bawaan,3
asn bea cukai atawa asn pajak atawa endorse,3
ndak masuk negara masuk kantong pajak negri dri negeri,3
darster ribu kena pajak juta,3
bawa barang makanan korea kena pajak,3
anak pajak keluarga pegawai pajak,3
uawala mata duitan buanget makanan souvenir kena pajak,3
jam pakai berharga us kena pajak,3
kemarin malaysia pakai emas kena pajak beacukairi penjilat,3
pegawai bea pajak ketar ketir,3
masak nilai pajak hrga barang,3
pajak cukai harga pakaian ribu kena pajak juta rumus,3
anggota bea cukai bayar pajak pulang dri negri,3
harga ribu pajak juta tolong jelasin,3
bawa taik kena pajak undang celeeeeeeeehhhh,3
ngalamin pacaran ldr suka dikirimin hadiah eh kena pajak mahal bilang gausah kirim pajak beacukai korup,3
dibawah kena pajak exploit dihapus,3
wna masuk kena pajak,3
personal use sodara dipakai melekat kalung emas berat grm loket bayar pajak,3
bagasi kna pajak,3
barang suka bea cukai dikenakan pajak tntu prcaya u bkn,3
iihhh mbaknyaa lucu tas dipake thn thun lo kena pajak baju dipakai,3
dugaan dasar pengenaan pajak dugaan liar terkontrol,3
knapa bawa indo taiwan banyakkk kena pajak beacukai taiwan,3
ribet sprti pahlawan devisa banyk peraturan sprt kargo cm baju bekas hrs byr pajak,3
klu jual kena pajak klu pki pribadi lsg klu bli bandara plastik,3
cangkeme iki manis lk baju bekas kena pajak pakaian ganti,3
alah kena pajak bawa barang jpn ribet,3
beli jam tangan ditangan kena pajak,3
naksir harga barang tag harganya suka besaran pajak gede harga barangnya,3
hp besok jm tangan kena pajak,3
air minum diluar negri diperut keinci kena pajak jugajadi kencing kelar,3
pulang umroh bawa kena pajak jugs,3
setahu kena pajak list barang batas max dibawa,3
hp melekat napa kena pajak,3
rombongan trip negeri singapura oleholeh kena pajak kah,3
kena pajak transfer rekening perseorangan,3
terimakasih informasinya percaya pajak,3
minimal kena pajak berubah,3
yakah hp pakek loe kena pajak jugak,3
apakabar baju bekas sepatu bekas krm kena pajak,3
penerbitan passport pling kasi la pamflet pajak msalah,3
pajak ktanya uang masuk negara ahhh,3
bawa basreng negri pack kena pajak beacukairi,3
kakak bayar pajak tunai transfer rekening kemenkeu,3
malaysia bawa ole kena pajak i donesia kena pajak,3
persetan bea cukai pajak,3
bawa makanan kena pajak,3
pajak berlaku tkwtki,3
pajak beli rubicon cuuy,3
duta bea cukai pajak magang,3
pajak barang hrs dibayar disalahgunakan oknum bea cukai,3
bawa jajanan coklat makan masak bayar pajak,3
dikit pajaksekrang kx dikit pajak,3
kabarnya gamis ribu kena pajak juta tolong jelasin,3
kena pajak pulang pke kolor,3
baju tag harga buangelak pajak,3
mie gantung leheratau bikin sabuk pinggang kena pajak,3
fyp diatas kirim coklat harga juta kena pajak juta,3
haaalah baju yag pakek dikirim pulag kenek pajak,3
skg kagak percaya pajak indo,3
ok brang pakemisal bawa emasperhiasan kg kena pajak,3
barang bekas harikena pajak,3
bawa panci presto harga rm rupiah ribu kena pajak,3
hadehhhh kirim barang bekas kena pajak babu,3
barang ribu kena pajak ribu tinggal hitung hitung sedekah manusia berseragam,3
kena pajak tkwtki tikus tikus kena,3
pakean selemari berlapis dibadan kena pajak,3
pemasukan negara pajak bahaya cari uang diluar,3
beli coklat bungkusnya ganti kantong kresekntar kna pajak ci,3
coklat kenak pajak jugak,3
bawa pisang goreng biji negeri kena pajak nihkrn bea cukai abis dimakan wehweh weehhh,3
lha baju bekas pakai kena pajak,3
kabar artis beli barang negriapakah kena pajak,3
bawa laptop sndri kna pajak,3
bwak makanan kena pajak mvbak,3
bedanya lihat manadan uangnya ditranfer negara perolehan pajak barangnya negara,3
tolong bawa sprei selimut kena pajak,3
trs plng negara indo negri bawa barang dikenakan pajak,3
klu bawa milo coklet kena pajak,3
free pajak cemilan sndiri,3
habis konser bawa lightstick dibeli lsnya kena pajak kah,3
barangnya badan melekat boxnya kena pajak contoh hp,3
kalopun diitung pajak barang harga pajaknya masuk akal barang mahal mahal nyampe pajak harga barang,3
contoh kmaren baju tkw hongkong gamis ribu pajak juta,3
itungan pajak kena,3
tki pulang bawa baju barang sndri pribadi tuhapa kena pajak kena,3
besok beli baju okeh pakek gaes stel pkek semuadi tumpuk kena pajak,3
duta pajak indonesia,3
istri import kena pajak pakai badan,3
tai didalam perut kena pajak,3
tkw beli gamis ribu kena pajak juta dipke ttep kena pajak bea cukai,3
pakai kena pajak,3
kaaku pulang liburan kena bawakrn setahu kena pajak,3
kena pajak dipakai,3
beli produk uda kena pajak tinggal bawa pulang kena,3
habis pulang jepang bawa kena pajak bawa lho imigrasi taiwan indonesia,3
cargo dikirim bayar pajak hilang barang,3
beli coklat juta kena pajak akukan suka coklat negeri cemilan,3
herantaksiran pajak drmanabeli kpajak kperhitungannya drmana,3
kirim barang indonesia baju ber tag box taiwan kena pajak bea cukai taiwan,3
beli baju potong dipakai dibadan kena pajak maksudnya,3
beli baju dicopot tag pricenya kena pajak,3
makanan kena pajak,3
pulang mbabu taiwan nyangklong tas dior saddle bag kena pajak,3
enak kirim nyampe indo tinggal bagiin kena pajak bayar ongkir,3
kena pajak jgudah denger berita maketin gamis kena pajak juta,3
serius buka jastip kena pajak kah,3
setau minimum harga kena pajak,3
astaga untung kena pajak pulang koper beli keluarga,3
jam bijikalau dipakai pulang kena pajak,3
perasaan serbet iniknp apadi mintain pajak,3
thats why in islam pajak bea cukai hukumnya haram ygy,3
itupun potong pajak,3
gaji pajak dikurangi nnti guru,3
maju tunjangan gaji dinaikan lagirakyat bayar pajak,3
stop bayar pajak bayar pajak penggunaan apbn apbd akal akalan instansi pemerintah daerah pusat,3
perut urus rakyat sengsara bayar pajak gaji pejabat,3
indo samakan negara maju negara umr pajak gaji tentara polisi otomatis rajin patroli,3
howalaaaa hayukk yukk warga indonesia rajin bayar pajak,3
lengkap lini pajak bea cukai imigrasi walikota tingkat desa,3
dpr ri direktorat jenderal pajak ri kemenkeuri,3
malas bayar pajak,3
mikir bayar pajak,3
bikin mikir bayar pajak,3
brg cilik besarkan brani periksa beacukai pajak,3
cm nunggak pajak kendaraan bodong oknum,3
pejabat mobil motor mewah bayar pajak ngapain cape cari uang bayar pajak,3
ntn vidio diatas ibuk arisan intai oknum pajak,3
fakta bro jujur tetanga polisi motornya mati pajak,3
bg tolong labuhan batu selatan bayar pajak stnk sekian bayarnya sekian,3
tmen polisi polisi polisi suka bayar pajak uang halal,3
bayar pajak wajib beli robicon,3
pajak dihapus ketar ketir,3
intinya launpetugas bayar pajaklau bayar pajak denda,3
bnyak pembuatan sim bayar pajak,3
pegawai pajak polri hangat hangatnyananti adem kambuh,3
pagi belanja pajak,3
rakyat bayar pajak hrs pasukan,3
lupa bayar pajak,3
bayar pajak pemerintah lepas tanggung thd pendidikan rakyatnya,3
gass pns guru pajak gede,3
yha konoha sllu celah kkn segmen pendidikan kesehatan pajak dsb,3
gaji ribu kepotong pajak,3
laporan tahunan audit pajak audit perusahaan pencucian uang,3
maslaahnya pajak pembangunan pabrik mayan makannya dpet gede,3
muka ama ank pejabat pajak,3
anjirrr koo mukanya ank pajak,3
mukanya ama anak pajak,3
pajak polisi akurrrr,3
pengambilpengguna guru maeketplace membayar fee bayar berkala pajak tahunan,3
kerja scurparking jaga pos byr langsung proses byr pajak lahan,3
parkir ribu bayar pajak susah angso duo,3
samsat be adoeh calo yo kemarin bayar pajak total pajak bayar uang gaya lupo pulak,3
drpd pajak beli mobil dinas pakai strobo jalan rakyat pembayar pajak pajak membayar bpjs,3
bpjs byr pajak gx bpjs ttp byr pajak,3
gwe bayar pajak ggaji,3
aman potongan pajak,3
pegawai dirjen pajak gajian langsung beli fortuner,3
pd thn honor digaji dipotong pajak gajiannya kadang diterima niatkan ibadah,3
direktorat jenderal pajak ri tukaran nasib pejuang pendidikan,3
pembebasan pajak suka ngarang angkot gratis dasar lawak dana t pembangunan nihil,3
suveryor jasa consultant pajak contoh mario jasa consultan pajak perusahaan,3
lumayan pd rbbln dipotong pajak,3
naikan wajib pajak,3
serentak byr pajak,3
habis uang pajak,3
masyarakat bbm pajak harga barang meroket pret pret,3
kerja pingsantp bayar pajak bayar gaji diatas puluhan lipat gaji,3
imah beli rumah juta pajak rumah pasaran harga juta sahuti bayari juta,3
pusing bayar pajak mahal bayar untung,3
beli tanah juta pajak kekeuh njop bayarin diem,3
pajak daerah djp edukasi,3
berurusan pajak berurusan uang ujungnya dealan,3
bljr jual beli rumah pajak diurus djp namanya pajak penghasialan pengalihan tanah bangunan,3
pajak daerah parah ngaco habis pajak hiburan kaltim masuk akal ngalahin rampok,3
bro pajak pengalihan tanah bangunan alias jual beli rumah masuk pajak pusat djp,3
sistem pajak indo beli barang pajaknya mahal barga barangnya,3
pegawai pajak mahal kalee,3
petugas pajak ketar ketir,3
kadang binggung rumah murah dimata pajak mahalmending jual rumahjual pajak ajakita untung,3
uang pajak akeh go opo negara bnyk utang lucubanyakin bayar dpr tmbh bnyk utang,3
pajak cepet beli mobil,3
dg soimah beli dg harga deal but pajak dipercaya dibilang harganya sgtu,3
kakeknya suami suka dtgin pajak ditawarin bayar pajak sekian sekian bayarnya sayagak negara,3
petugas pajak atasan smp bawahan kyknya jujur makan uang rakyat jmlhnya dikittt,3
kemenkeuri beacukairi ditjenpajakri nagih pajak cepet bayar pajak,3
keluarga pejabat aman lingkaran kekuasaanpejabat tunggu surat cinta pajak salah,3
denger bneran bayar pajak previllege salah koreksi,3
instansi pajak rt nagih gede pajaknya,3
bayar pajak ngabisin pajak,3
bayar pajak rumah yeaa cmn situs ajha kendaraan,3
kabar pajakudah bayar pajak,3
pajak bayarin milirian,3
nutupin pajaknya pajak,3
pajaknya taat pajak,3
lha pajak bayari pendopo ne to mak lumayan untung,3
dipantau pajak nista riba asli,3
mangkakno sogeh sogeh pegawai pajak,3
giliran bayar pajak eh mlah beli rubicorn,3
pajak bebaaaaaaaaas,3
beli mobil pajak mgkin,3
pajak bawahan dikejar target soimah polisi dana bawahannya ready jtsiap komandan,3
pajak rak bayar pajak kon bayar pajak rego rak nalar sisan adoh doh dohhhh,3
bikin surat tanah lahir segede kaga nama buyut bayar pajak tanah meteran patungan trs byre,3
cari celah masuk kantong tukang pajak,3
pajak dimana sj memeras,3
pajak nguasain kota,3
pajak liat aset bank liat aset miskin,3
dicek pajak taat pajak,3
namanya pajak tugasnya majak,3
pajak pajak rubicon kabarnya boss,3
pajak bayar pajak bulannya anteng perbulan bayar pajak dikit dikulik ampe didatangin,3
parah prnh beli rumah kota bdg juta pajak bilang njop diatas ktanya dibilang nurunin harga buktiada,3
dibiasakan bayar pajak mario dendy enak susah bayar kagak bayar,3
belinya murah ngurus pajak pasaran wilayah situ hrusnya pajak juta juta,3
rumah tmpt kerja byr pajak juta nego gbs byr persulit pt,3
ky sayawaktu bli rumah juta bilang pajak juta njop diatas juta,3
noh mobil pegawai pajak wahhhhh,3
pajak pajak koyo gawe alam dunia wae,3
samkojack rumah gede pajak gede,3
dasar pelajaran pajak jaman sma adakrn kuliah mslh dana,3
tanah ha desa nama lihat harga pasaran nota pajak ortu juta diurus dinaikin juta pajak notaris juta,3
nyuruh mentrinya bro mentrinya gila pajak hutang negara otomatis cari pemasukan lewateni ggikan pajak lini,3
syukur masyarakat bayar pajak giliran uang rakyat dikorupsi trilyunan percaya,3
petugas pajak vibes ormas,3
pajaknya bayar pajak,3
pajak opo tukang,3
lucu pajak yaaa kepinteran,3
islam melarang memungut pajak rakyat,3
buset pajak pajakwkwkwkwkwgimana perpajaknwkwkwkw,3
bayarin pajak maksdnya,3
mirisnya negara hidup hasil pajak rakyat berkembang maju,3
keringat manis mulut petugas pajak,3
intinya pajak percaya masyarakat hrs percaya pajak,3
bayar pajak beli rubicon,3
pajak pajak pengen kul ambil perpjakan heran sma negeri,3
pegawai pajak beli robicon susah senang senang susah,3
ngomongin pajak inget mario dandymenteri pajak bayar pajak,3
yaaa emng bgitu tohh msalah duet orng pajak gercep,3
pemimpin pajak nga bayar pajak trs pie mksute,3
beli rumah juta pajak bilang juta harga pasardia beli jtcuan pajaknya,3
pegawai pajak sll ngadi rutin bayar dipersulit rutin byr ungkit,3
lha buk byar pajak dpet uang liburan,3
ngebangun rmh pajak mejeng dpn rmh trs,3
pajak hutang gede jalanan rusak alustista bpjs rugi duitnya kemanain,3
anjj mmg petugas pajak,3
kmrn beli tanah notaris berkasku dipulangin bayar pajak harga tanah manaaaa,3
era sri mulyani rakyat diperas pajak,3
tukang pajak kehabisan dana dikorupsi,3
mengalami instansi pajak unit eselon kemenkeu dilaporkan wwwwisekemenkeugoid,3
ribet musuh petugas pajak seakan kejar,3
hidup nyaman kampung rampok mengaku ngaku penagih pajak kampung nagih pajak rt,3
beli rumah daerah amplaz harga murah keluarga pajak harga amplaz pajaknya,3
mknya kerja pajak,3
masyarakat wajibkan byr pajak uang pajaknya telap,3
q beli juta enek input juta wkwkw pajak jual beli akire x lipat wkwkw,3
ngapain byr pajak byr pajak duitnya bt beli tas mewah pajak,3
pertanyaanrumah dirjen pajakbayar pajak yaaahhh,3
bongkar mak boroknya pajak serakah,3
lha pajaknya bayar pajak,3
pajak bayar pajak,3
pajak ki bobrok pajak indonesia mayoran pegawai pajak,3
heran pajak indonesia,3
nggak heran pajak,3
tolong pengertian pajak belikan anak mobil robicon,3
pajak targetknp targetkarena cicilan dibayar,3
ayo dukung petugas pajak robicon,3
pajak jual beli dasarnya njop kesepakatan harga,3
pegawai pajak mutasijangan dinas terllalu,3
pertanyak uang pajak dipakek woy bayar mahal mahal,3
dasyat pajak jual beli rumah jual rumah kena pajak belu rumah kena pajak rumah jual kena pajak,3
diperiksa pajak dikorupsi pajak,3
ditekan pajak mak,3
bebaskan perpajakanuang pajak,3
pajak percaya kiamat,3
pajak hebat hebat anaknya raya standar mobilnya aj rubicon pantesan datengin soimah,3
pajak bobo nyenyak,3
percaya soimahdaripada pajak,3
bijak kena pajak,3
kanggo sangu ning neraka kuwi tukang pajak,3
uang pajak beli harley,3
direktorat jenderal pajak ri woi anak buah lu,3
halah kyak nagih bayar pajak cek,3
beli excavator bekas harga juta pajak bilang harga an juta bayarin juta nggak,3
pajak nyaa bayar pajakk,3
setipis tissue kepercayaan masyrakat intansi pajak,3
pajak kendaraan emng kudu bayar,3
bayar pajak kendaraan,3
polisi pajak bea cukai,3
bkn cm intansi pajak asn kyny,3
pajak kepolisian,3
mkanya bayar pajak,3
abis polisi instansi pajak,3
pajak aj bea cukai,3
cuman instansi pajak,3
pajak pengen cepet pnya rubicon lohhh,3
direktorat jenderal pajak ri kompas tv najwa shihab,3
pajak pingin beli rubicon,3
negeri surganya pajak,3
pajak diperbaiki pantesan pajak kya,3
oramg pajak dp rubicon mbagimana,3
beli rubicon bebas pajak seumur hidup,3
mohon pengertiannya mak soimah pajak hrs beliin rubicon anak nua,3
pajak sri mulyani,3
lautan fakta ngalamin aset kepemilikan bikin geleng telat bayar pajak teguran surat,3
pajak ladang uang,3
pieee direktorat jenderal pajak ri,3
bijak byr pajak pajak maling uang pajak dajal koruptor,3
mulane pegawe pajak kabeh sugih,3
pajak tukang begal,3
maling teryata pajak bongkar,3
jngn byr pajak byr pajak uang korupsi,3
mafia pajak meresahkan masarakat,3
pegawai pajak mahal,3
palak berkedok pajak,3
spil muka pajak ngukur,3
bpk penjara x uang pajak,3
parah direktorat jenderal pajak ri kerjanya rampok,3
dngan membayar pajak berati membantu menyelamatkan pegawai pajak dosa,3
cenn gali kabeh isine pajak,3
bayar pajak tnggal indonesia korupsi pajak,3
mak pendopo jual pajak milyar versi pajak bilang lu untung milyar,3
pegawe pajak luargiaaso,3
fix pajak setan uang,3
bayar pajak persen uangnya kenegara takutnya oknum,3
sadar pajak mikir akhirat bgmn nti hisap takut swt,3
mknya pajak matinya susah,3
pajak nyari uang ganti masuk pajak,3
stop bayar pajak,3
parah cukong cukong bikin pabrik kaga bayar pajak,3
bayar pajak kendaraan pungli dikasih uang ribet dipalakin,3
dol wae mae ming pajak lumayan untung nek ngono,3
rakyat bayar pajak biayai anggota dpr pemerintah rakyat susah terlantar cari makan susah bangsatnya disitu,3
jirrrr korupsinya berduit pajak stop pajak besok pegawai pajak nilai pampang publik,3
anak pajak pamer harley pamer mobil mewah ayok rakyat giat bayar pajak,3
nyuruh pajak bayar pajakd nurul,3
pajak numpang hidup,3
miskinkan pegawai pajak departemennya rasakan,3
pantes pajak cepet,3
merektuh perampok rakyat berdalih pajak bpjs,3
pantes bnyk ulama bilang kerja pajak msk surga,3
makan uang pajak tdak mencium bau surga memungut pajak kasih harumnya kasih liat,3
tolol jadikan penjabat pajak sibpenjabat pajaknya bayar pajak,3
pajak premanhhh uang blikan robicon,3
panteslah anak jendral pajak naek rubiconhasil korup,3
pajak babi kerja enak,3
pajak matinya tenang,3
gemes pajakya ajarajin bayar pajak makan kena pajak indonesia hutangnya,3
ngapain pajak nyusahin,3
pajak gampang cari uang,3
krj pajak ng bayar pajakmalah maling pajak,3
matematika pajak guru koruptor,3
tukang pajak perampok elit dilindungi,3
uang pajak beli rubicon pejabat pantek,3
ayo boikot bayar pajak merugikan masyarakat kalah kalahin jepang jaman binatang pajak,3
ohh orng pajak orng sumbangan kasih ikhlas nnti pajak ganti sumbangan emng kadang pajak,3
